id,conversation_id,created_at,date,time,timezone,user_id,username,name,place,tweet,language,mentions,urls,photos,replies_count,retweets_count,likes_count,hashtags,cashtags,link,retweet,quote_url,video,thumbnail,near,geo,source,user_rt_id,user_rt,retweet_id,reply_to,retweet_date,translate,trans_src,trans_dest
1413774888284790790,1413774888284790790,2021-07-10 08:19:34 UTC,2021-07-10,08:19:34,+0000,80101218,aki_u_ench,宮沢章夫（笑ってもピンチ）,,「筆一本で生きてきた」はすごい言葉だな。筆一本かよ。２本ぐらい用意したらどうか。あと、キーボードが主流の現在、筆というのはどうなんだと人は考えるだろうが、ペンになったときも同様の問題はあったはずだ。そこを乗り越えてきた筆一本の力は強い。エッセイみたいなものを書いてしまった。,ja,[],[],[],2,10,87,[],[],https://twitter.com/aki_u_ench/status/1413774888284790790,False,,0,,,,,,,,[],,,,
1413245921601613829,1413244419461976068,2021-07-08 21:17:39 UTC,2021-07-08,21:17:39,+0000,80101218,aki_u_ench,宮沢章夫（笑ってもピンチ）,,だからマラソン中継もトーク番組で、選手のことを徹底的に取材しなんでも知っている増田明美さんがすごすぎる。日本のテレビ番組はすべてトーク番組になるのだな。,ja,[],[],[],0,6,56,[],[],https://twitter.com/aki_u_ench/status/1413245921601613829,False,,0,,,,,,,,[],,,,
1413244419461976068,1413244419461976068,2021-07-08 21:11:41 UTC,2021-07-08,21:11:41,+0000,80101218,aki_u_ench,宮沢章夫（笑ってもピンチ）,,元プロ野球選手の谷繁か解説するプロ野球中継を見て気がついた。プロ野球中継はトーク番組だ。ゲームの性質上、長い間ができる。そこを的確な分析によるトークで埋める。谷繁は鋭いな。そのトーク番組はトーク力以上に分析能力が求められる。アナウンサーもまた。サッカー中継は純粋なスポーツ中継か。,ja,[],[],[],2,7,76,[],[],https://twitter.com/aki_u_ench/status/1413244419461976068,False,,0,,,,,,,,[],,,,
1413177613170839552,1413177613170839552,2021-07-08 16:46:13 UTC,2021-07-08,16:46:13,+0000,80101218,aki_u_ench,宮沢章夫（笑ってもピンチ）,,はじめオリンピックは開催すべきかの世論調査があった。いつのまにか、開会式は無観客かどうかへと焦点がずらされ、あたかも無観客と答えた人もまた、オリンピックに賛成しているかのように見なされ、この姑息な論法を何段階も進めると、閉会式は有観客になるのではないか。あと、バッハな。,ja,[],[],[],0,95,382,[],[],https://twitter.com/aki_u_ench/status/1413177613170839552,False,,0,,,,,,,,[],,,,
1413118504891338754,1413118504891338754,2021-07-08 12:51:20 UTC,2021-07-08,12:51:20,+0000,80101218,aki_u_ench,宮沢章夫（笑ってもピンチ）,,このあいだの選挙で当選した都民ファーストの女性が無免許運転で事故。議員を辞めろと圧力がかかっているとの報道だが、やめたら繰り上げ当選は自民か。ま、どっちもどっちだが。免停停止の期間を間違えて運転したって、そんなおっちょこちょいはだめだし、そもそもなんで免停になったんだよ。,ja,[],[],[],0,6,58,[],[],https://twitter.com/aki_u_ench/status/1413118504891338754,False,,0,,,,,,,,[],,,,
1412890341028483072,1412890341028483072,2021-07-07 21:44:42 UTC,2021-07-07,21:44:42,+0000,80101218,aki_u_ench,宮沢章夫（笑ってもピンチ）,,撮り直し終了。疲れた。背筋を伸ばしてカメラの前に座ると肩が痛い。途中「消毒」という言葉が出てこなくてかなり沈黙。なぜた。,ja,[],[],[],0,1,16,[],[],https://twitter.com/aki_u_ench/status/1412890341028483072,False,,0,,,,,,,,[],,,,
1412840173394481156,1412836501491044354,2021-07-07 18:25:21 UTC,2021-07-07,18:25:21,+0000,80101218,aki_u_ench,宮沢章夫（笑ってもピンチ）,,これまで10年以上やっている。そして今期とうとう出た。初めてだったよ「宮沢章夫」だ。発表が終わると学生に発表動機とか、内容について詳しく質問するのだが聞くことがなにもなかった。マンドリンを弾いた学生もいた。キーボードを用意してミスチルのコード進行を解説した者もいた。ほんといいなあ。,ja,[],[],[],0,2,47,[],[],https://twitter.com/aki_u_ench/status/1412840173394481156,False,,0,,,,,,,,[],,,,
1412837771987755008,1412836501491044354,2021-07-07 18:15:48 UTC,2021-07-07,18:15:48,+0000,80101218,aki_u_ench,宮沢章夫（笑ってもピンチ）,,これまでにも「サブカルチャー論演習」では伝説に残る発表が数多くあった。ある男性の氏名。僕の知らないイケメン俳優なのかなと思って黙って聞いていたら「anan」のセックス特集の付録DVDに出てくるイケメンだった。その手のものはいくつかあり、そのたびにすぐカーテンを閉めろと命じたのだった。,ja,[],[],[],1,1,32,[],[],https://twitter.com/aki_u_ench/status/1412837771987755008,False,,0,,,,,,,,[],,,,
1412836501491044354,1412836501491044354,2021-07-07 18:10:45 UTC,2021-07-07,18:10:45,+0000,80101218,aki_u_ench,宮沢章夫（笑ってもピンチ）,,そんなとき緊急事態宣言が出てしまうのか。学生からも対面授業は感染が怖いと連絡をもらっていて、ハイブリッドにしようと思っていたがやはりZoom一本か。発表を楽しみにしてくれていた学生もいたんだよなあ。僕も演習の学生の発表が大好きなのに。,ja,[],[],[],1,2,55,[],[],https://twitter.com/aki_u_ench/status/1412836501491044354,False,,0,,,,,,,,[],,,,
1412835645337202692,1412835645337202692,2021-07-07 18:07:21 UTC,2021-07-07,18:07:21,+0000,80101218,aki_u_ench,宮沢章夫（笑ってもピンチ）,,そして、体調は悪いがいますぐ撮り直しをしようと、そのときの衣装を出してきてこんな時間に着替える。今週末は20本撮りとかしようと思うんですよ。短い時間で内容をささっと解説。編集なし。地獄の週末。,ja,[],[],[],0,1,18,[],[],https://twitter.com/aki_u_ench/status/1412835645337202692,False,,0,,,,,,,,[],,,,
1412822149077688327,1412822149077688327,2021-07-07 17:13:43 UTC,2021-07-07,17:13:43,+0000,80101218,aki_u_ench,宮沢章夫（笑ってもピンチ）,,都議選のあと、会見に出てきたある政党の東京都の女性代表の後ろに、その方の選挙用のポスターがあるのをテレビで見た。思わず写真を撮り「Photoshopは偉大！」と投稿しょうと思ったが、あまりに失礼なのでやめました。,ja,[],[],[],0,6,53,[],[],https://twitter.com/aki_u_ench/status/1412822149077688327,False,,0,,,,,,,,[],,,,
1412814692897095684,1412814692897095684,2021-07-07 16:44:06 UTC,2021-07-07,16:44:06,+0000,80101218,aki_u_ench,宮沢章夫（笑ってもピンチ）,,収録したオンデマンド動画を編集していた。途中の動画からなぜか音声がまったく入ってなかった。体調も悪いんだよ。なぜ悪いことは重なるのか。,ja,[],[],[],0,1,8,[],[],https://twitter.com/aki_u_ench/status/1412814692897095684,False,,0,,,,,,,,[],,,,
1412392895911395331,1412392895911395331,2021-07-06 12:48:02 UTC,2021-07-06,12:48:02,+0000,80101218,aki_u_ench,宮沢章夫（笑ってもピンチ）,,鍼を打ってきた。ものすごく痛かったがだいぶ楽になった。ゼミの途中、鍼に行くと学生たちに声をかけたらみんなが励ましてくれたり、歓声をあげたり。送り出される時「ソーイングビーの敗者か俺は」と言ったら一人にしか理解してもらえなかった。,ja,[],[],[],1,14,114,[],[],https://twitter.com/aki_u_ench/status/1412392895911395331,False,,0,,,,,,,,[],,,,
1411931725123383299,1411931725123383299,2021-07-05 06:15:30 UTC,2021-07-05,06:15:30,+0000,80101218,aki_u_ench,宮沢章夫（笑ってもピンチ）,,恐ろしいな酒。,ja,[],[],[],0,18,61,[],[],https://twitter.com/aki_u_ench/status/1411931725123383299,False,https://twitter.com/tsuredure_bot1/status/1411908607101136902,0,,,,,,,,[],,,,
1411931309048426498,1411931309048426498,2021-07-05 06:13:51 UTC,2021-07-05,06:13:51,+0000,80101218,aki_u_ench,宮沢章夫（笑ってもピンチ）,,首、肩、肩甲骨の痛みの大元がわかった。右手の肘から下だ。マウスだ。マウスの疲れで痛みが発生している。,ja,[],[],[],3,2,25,[],[],https://twitter.com/aki_u_ench/status/1411931309048426498,False,,0,,,,,,,,[],,,,
1411705119180083206,1411705119180083206,2021-07-04 15:15:03 UTC,2021-07-04,15:15:03,+0000,80101218,aki_u_ench,宮沢章夫（笑ってもピンチ）,,なぜ東京都議選の開票速報を全国でやっているのかと疑問に思う方は箱根駅伝にも疑問を持ったほうがいいと思う。首の周辺から肩、肩甲骨にかけて痛くてたまらないのでこんなことを考えてる場合ではないのだが。,ja,[],[],[],0,15,76,[],[],https://twitter.com/aki_u_ench/status/1411705119180083206,False,,0,,,,,,,,[],,,,
1410961535589965832,1410961535589965832,2021-07-02 14:00:19 UTC,2021-07-02,14:00:19,+0000,80101218,aki_u_ench,宮沢章夫（笑ってもピンチ）,,ちよ、ちょっと・・・,ja,[],[],[],0,2,10,[],[],https://twitter.com/aki_u_ench/status/1410961535589965832,False,https://twitter.com/noribiyori/status/1410959981126426626,0,,,,,,,,[],,,,
1410959247668437003,1410959247668437003,2021-07-02 13:51:13 UTC,2021-07-02,13:51:13,+0000,80101218,aki_u_ench,宮沢章夫（笑ってもピンチ）,,とにかく体調が悪い。,ja,[],[],[],5,2,26,[],[],https://twitter.com/aki_u_ench/status/1410959247668437003,False,,0,,,,,,,,[],,,,
1410893752353230848,1410893752353230848,2021-07-02 09:30:58 UTC,2021-07-02,09:30:58,+0000,80101218,aki_u_ench,宮沢章夫（笑ってもピンチ）,,演習２コマ終わって学生の発表は面白かったが、僕のほうの体調は最悪。どうしたんだろう。,ja,[],[],[],1,1,8,[],[],https://twitter.com/aki_u_ench/status/1410893752353230848,False,,0,,,,,,,,[],,,,
1410893350614355968,1410893350614355968,2021-07-02 09:29:22 UTC,2021-07-02,09:29:22,+0000,80101218,aki_u_ench,宮沢章夫（笑ってもピンチ）,,ありがとうございます。知人に教えられツイートを知りました。「Tao of Cow」に気が付いてもらえるとは。,ja,[],[],[],1,1,13,[],[],https://twitter.com/aki_u_ench/status/1410893350614355968,False,https://twitter.com/sadagakusyu/status/1410806891366830083,0,,,,,,,,[],,,,
