id,conversation_id,created_at,date,time,timezone,user_id,username,name,place,tweet,language,mentions,urls,photos,replies_count,retweets_count,likes_count,hashtags,cashtags,link,retweet,quote_url,video,thumbnail,near,geo,source,user_rt_id,user_rt,retweet_id,reply_to,retweet_date,translate,trans_src,trans_dest
1295789560249499648,1295769485765259265,2020-08-18 18:28:00 UTC,2020-08-18,18:28:00,+0000,34,ariel,Ariel Poler,,"@jbreinlinger Not quite, but close:  https://t.co/lfDO1os1SB",en,[],['https://www.misu.app/'],[],2,0,0,[],[],https://twitter.com/ariel/status/1295789560249499648,False,,0,,,,,,,,"[{'screen_name': 'jbreinlinger', 'name': 'Josh Breinlinger', 'id': '16347430'}]",,,,
1272934132662693889,1272934132662693889,2020-06-16 16:48:41 UTC,2020-06-16,16:48:41,+0000,34,ariel,Ariel Poler,,Hypnotherapy via Amazon Alexa  https://t.co/ur5jFnxAC7,en,[],['https://bigthink.com/mind-brain/hypnotherapy-service-amazon-alexa-reveri-health'],[],3,1,18,[],[],https://twitter.com/ariel/status/1272934132662693889,False,,0,,,,,,,,[],,,,
1263624711478501376,1263624711478501376,2020-05-22 00:16:22 UTC,2020-05-22,00:16:22,+0000,34,ariel,Ariel Poler,,"Excited to launch an Alexa skill to help with Covid-19 generated anxiety. Simply tell Alexa to start ""Hypnosis Stress Relief"". Or go to  https://t.co/Wouy9lY6MQ. Know someone who is stressed? Let them know. #nomorestress.",en,[],['http://www.reverihealth.com/stress'],[],2,4,16,['nomorestress'],[],https://twitter.com/ariel/status/1263624711478501376,False,,0,,,,,,,,[],,,,
1232483124925173760,1232483124925173760,2020-02-26 01:50:50 UTC,2020-02-26,01:50:50,+0000,34,ariel,Ariel Poler,,"I am working on a project about evolutionary traits that were important thousands of years ago, but are now harmful. For example, our inclination to eat whenever food is in front of us. I am trying to create a comprehensive list of these traits. Do you have examples or pointers?",en,[],[],[],8,4,9,[],[],https://twitter.com/ariel/status/1232483124925173760,False,,0,,,,,,,,[],,,,
1222569804927684610,1222569804927684610,2020-01-29 17:18:50 UTC,2020-01-29,17:18:50,+0000,34,ariel,Ariel Poler,,"@elonmusk how about allowing me to power my home in Marin from my Model X? It would be very handy when PG&amp;E cuts power... I realize it is not a good ""permanent"" solution, but it seems perfect for occasional use...",en,[],[],[],0,0,4,[],[],https://twitter.com/ariel/status/1222569804927684610,False,,0,,,,,,,,[],,,,
1210601859854913538,1210601859854913538,2019-12-27 16:42:29 UTC,2019-12-27,16:42:29,+0000,34,ariel,Ariel Poler,,Thank you @VoiceflowHQ for the great piece about the work I am doing with Dr. David Spiegel to reduce pain and addiction with hypnotherapy.  https://t.co/avQbVXHa0D,en,"[{'screen_name': 'voiceflowhq', 'name': 'voiceflow (vf)', 'id': '1107420575557779456'}]",['https://www.voiceflow.com/blog/creator-highlight-ariel-poler'],[],3,7,14,[],[],https://twitter.com/ariel/status/1210601859854913538,False,,0,,,,,,,,[],,,,
1206745289312198656,1206745289312198656,2019-12-17 01:17:51 UTC,2019-12-17,01:17:51,+0000,34,ariel,Ariel Poler,,Fascinating afternoon hearing about the cutting age longevity research taking place at @BuckInstitute  https://t.co/mKJlh3FI7w,en,"[{'screen_name': 'buckinstitute', 'name': 'buck institute', 'id': '216455187'}]",[],['https://pbs.twimg.com/media/EL84aMEUwAE80_Y.jpg'],1,0,5,[],[],https://twitter.com/ariel/status/1206745289312198656,False,,1,https://pbs.twimg.com/media/EL84aMEUwAE80_Y.jpg,,,,,,,[],,,,
1198698627863957504,1198698627863957504,2019-11-24 20:23:18 UTC,2019-11-24,20:23:18,+0000,34,ariel,Ariel Poler,,Excited to share that Roam Robotics is launching their ski exoskeleton - Elevate - this winter. Elevate helps you ski past your physical boundaries. Learn more at  https://t.co/dpb701tDRY and use the promo code “ROAMVIP15” to get 15% off.,en,[],['http://www.roamrobotics.com/ski'],[],1,0,3,[],[],https://twitter.com/ariel/status/1198698627863957504,False,,0,,,,,,,,[],,,,
1173677897321607169,1173677897321607169,2019-09-16 19:19:51 UTC,2019-09-16,19:19:51,+0000,34,ariel,Ariel Poler,,Congrats Felicia! BTW: Binti is hiring :-).,en,[],[],[],0,0,5,[],[],https://twitter.com/ariel/status/1173677897321607169,False,https://twitter.com/FeliciaCurcuru/status/1173628537145896961,0,,,,,,,,[],,,,
1155252817780588544,1155252817780588544,2019-07-27 23:05:09 UTC,2019-07-27,23:05:09,+0000,34,ariel,Ariel Poler,,Inspiring evening hearing about the great work of @demworksinc and @voting_works. Thank you @Sethflaxman and @benadida.  https://t.co/04Y5R9Ae4B,en,"[{'screen_name': 'demworksinc', 'name': 'democracy works, inc', 'id': '2619096480'}, {'screen_name': 'voting_works', 'name': 'votingworks', 'id': '1032851908866727936'}, {'screen_name': 'sethflaxman', 'name': 'seth flaxman', 'id': '16544810'}, {'screen_name': 'benadida', 'name': 'ben adida', 'id': '14451083'}]",[],['https://pbs.twimg.com/media/EAhITqwU4AAUs33.jpg'],0,1,12,[],[],https://twitter.com/ariel/status/1155252817780588544,False,,1,https://pbs.twimg.com/media/EAhITqwU4AAUs33.jpg,,,,,,,[],,,,
1125430948307202048,1125430948307202048,2019-05-06 16:03:42 UTC,2019-05-06,16:03:42,+0000,34,ariel,Ariel Poler,,"""It is a good time to be a mouse"". Best one-liner at the MIT BrainMind Summit this weekend. Most brain research has been done on mice, but very little has been shown to be effective in humans yet.  https://t.co/hOSGM2PIUd",en,[],[],['https://pbs.twimg.com/media/D55UuP1U8AA2Qpk.jpg'],1,0,11,[],[],https://twitter.com/ariel/status/1125430948307202048,False,,1,https://pbs.twimg.com/media/D55UuP1U8AA2Qpk.jpg,,,,,,,[],,,,
1125062075464724482,1125062075464724482,2019-05-05 15:37:56 UTC,2019-05-05,15:37:56,+0000,34,ariel,Ariel Poler,,"Awesome conversation with @rodneymullen and @jseelybrown: how do you practice stuff that can get you killed? Flow, creativity and keeping your ribs in one piece! #BrainMindMIT2019  https://t.co/UuYPjMiitF",en,"[{'screen_name': 'rodneymullen', 'name': 'rodney mullen', 'id': '907434824859660288'}, {'screen_name': 'jseelybrown', 'name': 'john seely brown', 'id': '16597921'}]",[],['https://pbs.twimg.com/media/D50F_ibW0AE1yYG.jpg'],1,0,5,['brainmindmit2019'],[],https://twitter.com/ariel/status/1125062075464724482,False,,1,https://pbs.twimg.com/media/D50F_ibW0AE1yYG.jpg,,,,,,,[],,,,
1124653770175070209,1124653770175070209,2019-05-04 12:35:28 UTC,2019-05-04,12:35:28,+0000,34,ariel,Ariel Poler,,Intellectual weekend ahead... #brainmind #humanaugmentation #mit  https://t.co/oXJRgvekPU,en,[],[],['https://pbs.twimg.com/media/D5uSojQWwAAvcUL.jpg'],1,1,21,"['brainmind', 'humanaugmentation', 'mit']",[],https://twitter.com/ariel/status/1124653770175070209,False,,1,https://pbs.twimg.com/media/D5uSojQWwAAvcUL.jpg,,,,,,,[],,,,
1118628014567202816,1118628014567202816,2019-04-17 21:31:16 UTC,2019-04-17,21:31:16,+0000,34,ariel,Ariel Poler,,Congratulations to @eduardovilar and the entire @returnly team on a great financing.  #justgettingstarted  https://t.co/9KXWI1Z9vo,en,"[{'screen_name': 'eduardovilar', 'name': 'eduardo vilar', 'id': '39960711'}, {'screen_name': 'returnly', 'name': 'returnly', 'id': '501355186'}]",['https://www.forbes.com/sites/laurendebter/2019/04/17/this-max-levchin-backed-company-is-tackling-the-100-billion-returns-industry/#7f0f1d7215dd'],[],0,0,6,['justgettingstarted'],[],https://twitter.com/ariel/status/1118628014567202816,False,,0,,,,,,,,[],,,,
1117132553259868162,1117132553259868162,2019-04-13 18:28:50 UTC,2019-04-13,18:28:50,+0000,34,ariel,Ariel Poler,,At the @code4venezuela hackathon. Taking place in San Francisco and remote locations all over the world. Inspiring! #CodeForVenezuela  https://t.co/1deySJ4zXk,en,"[{'screen_name': 'code4venezuela', 'name': '🅲🅾🅳🅴 𝘧𝘰𝘳 𝗩𝗘𝗡𝗘𝗭𝗨𝗘𝗟𝗔 🇻🇪', 'id': '1106215183016321024'}]",[],['https://pbs.twimg.com/media/D4DaIXzUcAE_4K6.jpg'],0,3,36,['codeforvenezuela'],[],https://twitter.com/ariel/status/1117132553259868162,False,,1,https://pbs.twimg.com/media/D4DaIXzUcAE_4K6.jpg,,,,,,,[],,,,
1117119512803807234,1117119512803807234,2019-04-13 17:37:01 UTC,2019-04-13,17:37:01,+0000,34,ariel,Ariel Poler,,@code4venezuela’s hackathon is starting in San Francisco and remote locations all over the world. Inspiring! #CodeForVenezuela  https://t.co/pySTmVgHAs,en,[],[],['https://pbs.twimg.com/media/D4DOQnvUcAEzKit.jpg'],0,3,12,['codeforvenezuela'],[],https://twitter.com/ariel/status/1117119512803807234,False,,1,https://pbs.twimg.com/media/D4DOQnvUcAEzKit.jpg,,,,,,,[],,,,
1108125289572253696,1108125289572253696,2019-03-19 21:57:11 UTC,2019-03-19,21:57:11,+0000,34,ariel,Ariel Poler,,"Congratulations @maccaw and the entire @clearbit team on your recent $15MM financing  https://t.co/2DmOwhBLsw. Such a delight to work with you - and such a compelling product and company. Oh, and thank you @RafaelCorrales for introducing me to Alex!",en,"[{'screen_name': 'maccaw', 'name': 'alex maccaw', 'id': '2006261'}, {'screen_name': 'clearbit', 'name': 'clearbit', 'id': '2857311332'}, {'screen_name': 'rafaelcorrales', 'name': 'rafael corrales 🇺🇸🇻🇪', 'id': '8611832'}]",['https://blog.clearbit.com/series-a/'],[],0,0,10,[],[],https://twitter.com/ariel/status/1108125289572253696,False,,0,,,,,,,,[],,,,
1095152476624310272,1095152476624310272,2019-02-12 02:47:52 UTC,2019-02-12,02:47:52,+0000,34,ariel,Ariel Poler,,"InReach Ventures, the 'AI-powered' European VC, closes new €53M fund  https://t.co/DONBguHmL2 Congrats to @Bonanzinga @thesmith @johnmesrie and the entire @inreachventures team. Great milestone!",en,"[{'screen_name': 'bonanzinga', 'name': 'roberto bonanzinga - inreach ventures', 'id': '24503'}, {'screen_name': 'thesmith', 'name': 'ben smith', 'id': '788695'}, {'screen_name': 'johnmesrie', 'name': 'john mesrie', 'id': '2193410188'}, {'screen_name': 'inreachventures', 'name': 'inreach ventures', 'id': '3512904627'}]",['https://tcrn.ch/2RRpNcI'],[],4,5,34,[],[],https://twitter.com/ariel/status/1095152476624310272,False,,0,,,,,,,,[],,,,
1073235125830279168,1073235125830279168,2018-12-13 15:16:08 UTC,2018-12-13,15:16:08,+0000,34,ariel,Ariel Poler,,I just contributed to the Latin American Leadership Academy. They empower young leaders to make a difference in the region. Join me!!!  https://t.co/g2o8Bm2aOS,en,[],['https://next300lalachangemakers.causevox.com/'],[],1,0,4,[],[],https://twitter.com/ariel/status/1073235125830279168,False,,0,,,,,,,,[],,,,
1069965037987540992,1069965037987540992,2018-12-04 14:41:58 UTC,2018-12-04,14:41:58,+0000,34,ariel,Ariel Poler,,Congrats to the entire @BIOShealth team on raising their seed round - and on their new name! Really enjoy working together to augment the human body.  https://t.co/xMJfjBzFIU #humanaugmentation #formerlyCBAS,en,"[{'screen_name': 'bioshealth', 'name': 'bioshealth', 'id': '1045399400372146177'}]",['https://techcrunch.com/2018/12/04/bios-health/'],[],1,1,6,"['humanaugmentation', 'formerlycbas']",[],https://twitter.com/ariel/status/1069965037987540992,False,,0,,,,,,,,[],,,,
