id,conversation_id,created_at,date,time,timezone,user_id,username,name,place,tweet,language,mentions,urls,photos,replies_count,retweets_count,likes_count,hashtags,cashtags,link,retweet,quote_url,video,thumbnail,near,geo,source,user_rt_id,user_rt,retweet_id,reply_to,retweet_date,translate,trans_src,trans_dest
1413465844567273475,1413440622321491980,2021-07-09 11:51:32 UTC,2021-07-09,11:51:32,+0000,50255275,dondeli,DELI,,@24room もし本当にバスの運転手は感染らない設定だとしたら、例え感染しててもうつさない設定になってるのかもしれませんね。まあそもそも濃厚接触者の定義がおかしいんですよね。,ja,[],[],[],0,1,1,[],[],https://twitter.com/DONDELI/status/1413465844567273475,False,,0,,,,,,,,"[{'screen_name': '24room', 'name': 'Naoki Imaeda', 'id': '47962387'}]",,,,
1413382863655817216,1413379578425331713,2021-07-09 06:21:48 UTC,2021-07-09,06:21:48,+0000,50255275,dondeli,DELI,,組織委によると、聖火ランナーには濃厚接触者がいない。  聖火ランナーには？濃厚接触者はいない。 他にはいるという事か？  もはや周回遅れの濃厚接触者の定義では、濃厚接触者はいません！とアナウンスされても安全安心な運営がされてると思うわけないし、危ないなとか不安だなとしか思えない。,ja,[],[],[],2,272,367,[],[],https://twitter.com/DONDELI/status/1413382863655817216,False,,0,,,,,,,,[],,,,
1413379578425331713,1413379578425331713,2021-07-09 06:08:45 UTC,2021-07-09,06:08:45,+0000,50255275,dondeli,DELI,,運転手がコロナ陽性　関東３県でバス担当―聖火リレー〔五輪〕  男性は３日に千葉県で運営スタッフの送迎バス、５日に茨城県で聖火ランナーの現地送迎バス、６日に埼玉県で運営スタッフ用車両の運転をそれぞれ担当した。発症日は５日。  なんで発症後も運転してんの。。  https://t.co/SDf5fwD8mE,ja,[],['https://www.jiji.com/jc/article?k=2021070900522&g=spo'],[],16,1542,1880,[],[],https://twitter.com/DONDELI/status/1413379578425331713,False,,0,,,,,,,,[],,,,
1413239392752132103,1413239392752132103,2021-07-08 20:51:42 UTC,2021-07-08,20:51:42,+0000,50255275,dondeli,DELI,,酒提供の自粛要請応じる飲食店に ４万円の協力金を先払い 誓約書条件｜TBS NEWS  https://t.co/p6e3Xui5i8  一日４万円の協力金ってのは一律なんですかね？  なんで自粛要請に応じる事ができないお店があるのかわかってる？,ja,[],['https://news.tbs.co.jp/newseye/tbs_newseye4310517.html'],[],10,181,329,[],[],https://twitter.com/DONDELI/status/1413239392752132103,False,,0,,,,,,,,[],,,,
1413236710209581056,1413236710209581056,2021-07-08 20:41:03 UTC,2021-07-08,20:41:03,+0000,50255275,dondeli,DELI,,ヤングケアラーの課題と求められる支援 専門家に聞く  https://t.co/x6umtCyiAS  https://t.co/Q8XS2yV809,ja,[],['https://www.nhk.or.jp/shutoken/wr/20210405yc_c01.html'],['https://pbs.twimg.com/media/E5zTS8mVoAQcNmn.jpg'],0,9,8,[],[],https://twitter.com/DONDELI/status/1413236710209581056,False,https://twitter.com/dondeli/status/1413229581469773829,1,https://pbs.twimg.com/media/E5zTS8mVoAQcNmn.jpg,,,,,,,[],,,,
1413232406916583424,1413222323419680771,2021-07-08 20:23:57 UTC,2021-07-08,20:23:57,+0000,50255275,dondeli,DELI,,3年半くらい前に視察にいった堺市では、当時からすでに専門の相談窓口がありました。  https://t.co/wuhxikgmDN,ja,[],['https://www.city.sakai.lg.jp/smph/kenko/fukushikaigo/koreishafukushi/doublecare1.html'],[],0,8,11,[],[],https://twitter.com/DONDELI/status/1413232406916583424,False,https://twitter.com/dondeli/status/923122110406393856,0,,,,,,,,[],,,,
1413229798210428930,1413222323419680771,2021-07-08 20:13:35 UTC,2021-07-08,20:13:35,+0000,50255275,dondeli,DELI,,福祉まるごと相談窓口は 市役所本館1階　 高齢者支援課　 地域包括ケア推進担当室に設置されています。（電話047-366-1100）  https://t.co/Ykr1WWQatR,ja,[],[],['https://pbs.twimg.com/media/E5zNAobVgAAoMlo.jpg'],1,14,13,[],[],https://twitter.com/DONDELI/status/1413229798210428930,False,,1,https://pbs.twimg.com/media/E5zNAobVgAAoMlo.jpg,,,,,,,[],,,,
1413229581469773829,1413222323419680771,2021-07-08 20:12:43 UTC,2021-07-08,20:12:43,+0000,50255275,dondeli,DELI,,福祉に関する困り事（ダブルケアの相談、サービスや制度を知りたい、どこに相談して良いかわからない等）の相談窓口です。専門職が一緒に考え、必要なサービスをご紹介し、担当の課におつなぎします。  福祉まるごと相談窓口  https://t.co/jQwEuNjsq6,ja,[],['https://www.city.matsudo.chiba.jp/matsudodeikiiki/mokuteki/soudan/koureisougousoudan.html'],[],1,12,11,[],[],https://twitter.com/DONDELI/status/1413229581469773829,False,,0,,,,,,,,[],,,,
1413229317245444096,1413222323419680771,2021-07-08 20:11:40 UTC,2021-07-08,20:11:40,+0000,50255275,dondeli,DELI,,地域包括支援センターの守備範囲を超えるダブルケアや生活困窮などさまざまなものがありこうした相談には適切な機関へ同行して一緒に相談するなど寄り添い型で支援を行っていましたが、今年度より地域包括支援センターの専門職を増員するとともに福祉まるごと相談窓口も増設し相談体制の強化しています,ja,[],[],[],1,7,10,[],[],https://twitter.com/DONDELI/status/1413229317245444096,False,,0,,,,,,,,[],,,,
1413228600011071490,1413222323419680771,2021-07-08 20:08:49 UTC,2021-07-08,20:08:49,+0000,50255275,dondeli,DELI,,当然どこに相談したらいいかもわからない。相談を受け止める、サービスにつなぐといった相談体制は基本的には地域包括支援センターが担っていて、相談件数は平成30年度10月末時点で82158件と目標値を大幅に超えている状況でしたが、市民からの相談は複雑化・多様化しており、,ja,[],[],[],1,8,13,[],[],https://twitter.com/DONDELI/status/1413228600011071490,False,,0,,,,,,,,[],,,,
1413224100273672192,1413222323419680771,2021-07-08 19:50:56 UTC,2021-07-08,19:50:56,+0000,50255275,dondeli,DELI,,僕らの会派も3年くらい前から会派としてダブルケア、又はヤングケアラーと呼ばれる介護の問題を抱える人の実態を把握するためのアンケート調査等、現状把握の実施を予算要求でも要望していますが、3年ほど前ですらその定義すら曖昧で、自分がダブルケアラーやヤングケアラーだと自覚してない人も多い。,ja,[],[],[],1,11,13,[],[],https://twitter.com/DONDELI/status/1413224100273672192,False,,0,,,,,,,,[],,,,
1413222323419680771,1413222323419680771,2021-07-08 19:43:52 UTC,2021-07-08,19:43:52,+0000,50255275,dondeli,DELI,,私もヤングケアラーだった ～優等生の私が消しゴムを万引きしたわけ～ | NHK  https://t.co/Yh3htlMojd,ja,[],['https://www.nhk.or.jp/shutoken/wr/20210706yc.html'],[],1,23,32,[],[],https://twitter.com/DONDELI/status/1413222323419680771,False,,0,,,,,,,,[],,,,
1413175828674801664,1413174232662437889,2021-07-08 16:39:07 UTC,2021-07-08,16:39:07,+0000,50255275,dondeli,DELI,,この区域の排水升から6月29日に採取した水を分析した結果5月より放射性物質の濃度が高いことが判明。その後の調査でタンクそばの地表面で750μSv/hと高い線量を測定した為タンクを点検。  6月下旬の雨で汚染された水があふれ出たとみられ東電はふたを閉めてタンクをシートで覆い水が漏れないようにした,ja,[],[],[],0,43,31,[],[],https://twitter.com/DONDELI/status/1413175828674801664,False,,0,,,,,,,,[],,,,
1413174232662437889,1413174232662437889,2021-07-08 16:32:47 UTC,2021-07-08,16:32:47,+0000,50255275,dondeli,DELI,,ふた開けっ放しで汚染土保管タンク内に大量の雨水　東電福島第一原発：東京新聞 TOKYO Web  東京電力は8日、福島第一原発（福島県大熊町、双葉町）敷地内で、放射性廃棄物を保管する角形タンクのふたが開いたままになっており、中に大量の雨水がたまっていたと明らかにした。  https://t.co/lIq4673RyI,ja,[],['https://www.tokyo-np.co.jp/article/115436'],[],2,113,89,[],[],https://twitter.com/DONDELI/status/1413174232662437889,False,,0,,,,,,,,[],,,,
1413105092102811653,1413105092102811653,2021-07-08 11:58:02 UTC,2021-07-08,11:58:02,+0000,50255275,dondeli,DELI,,都内全会場「無観客」決定へ　五輪５者協議(日本テレビ系) #Yahooニュース  https://t.co/aRQJeGgNW0  今月１２日から東京都に緊急事態宣言が出されることを受け新型コロナの感染拡大を防止するため５者協議の場で、都内の会場はすべて「無観客」にすると決定することが関係者への取材でわかりました。,ja,[],['https://news.yahoo.co.jp/articles/00fd40678556b42c8507368f3015e6402f7f56e0?tokyo2020'],[],0,28,26,['yahooニュース'],[],https://twitter.com/DONDELI/status/1413105092102811653,False,,0,,,,,,,,[],,,,
1412720873463705604,1412720873463705604,2021-07-07 10:31:17 UTC,2021-07-07,10:31:17,+0000,50255275,dondeli,DELI,,松戸市では市内飲食店対象に感染症専門家のアドバイスを受けたい店舗を募集します！ 松戸商工会議所青年部、公益社団法人松戸青年会議所の有志の方々が先行的な取り組みとして、専門家とともに実証調査を行いました。市のアドバイザー制度は、この実証調査を参考に行います。  https://t.co/0levY9g51t  https://t.co/0utqiWXWqf,ja,[],['https://www.city.matsudo.chiba.jp/jigyosya/chushoncov/advisor_insyoku.html'],"['https://pbs.twimg.com/media/E5r-JUiVoAEQ8zS.jpg', 'https://pbs.twimg.com/media/E5r-JUhVUAIpbHd.jpg', 'https://pbs.twimg.com/media/E5r-JUgVoAQLBQ8.jpg', 'https://pbs.twimg.com/media/E5r-JUkUYAQWiu7.jpg']",0,21,21,[],[],https://twitter.com/DONDELI/status/1412720873463705604,False,https://twitter.com/dondeli/status/1412311992350613505,1,https://pbs.twimg.com/media/E5r-JUiVoAEQ8zS.jpg,,,,,,,[],,,,
1412710672014536708,1412710672014536708,2021-07-07 09:50:45 UTC,2021-07-07,09:50:45,+0000,50255275,dondeli,DELI,,ワクチンの予約取り消し「希望の量が届かない…」現場は | NHK  千葉県保険医協会の調査では、千葉県内で少なくとも26の自治体が供給不足を懸念し接種や予約の計画が立てにくくなっていることが分かりました。  https://t.co/X6y7BRpbX2,ja,[],['https://www.nhk.or.jp/shutoken/newsup/20210707a.html'],[],0,24,23,[],[],https://twitter.com/DONDELI/status/1412710672014536708,False,,0,,,,,,,,[],,,,
1412655206945280001,1412311992350613505,2021-07-07 06:10:21 UTC,2021-07-07,06:10:21,+0000,50255275,dondeli,DELI,,@anzu_sato @charrpei 失礼しました。名称が変わった事は知っていましたが、詳しい経緯は知りませんでした。特に意識して使っていませんでしたが、今後気をつけたいと思います。,ja,[],[],[],1,0,1,[],[],https://twitter.com/DONDELI/status/1412655206945280001,False,,0,,,,,,,,"[{'screen_name': 'anzu_sato', 'name': 'あんず（楠）🐾', 'id': '2605712490'}, {'screen_name': 'charrpei', 'name': '茶平', 'id': '485710482'}]",,,,
1412564969376284673,1412563493753028608,2021-07-07 00:11:47 UTC,2021-07-07,00:11:47,+0000,50255275,dondeli,DELI,, https://t.co/M46Tj0zoyE,und,[],[],"['https://pbs.twimg.com/media/E5pwV2bUYAEfKnO.jpg', 'https://pbs.twimg.com/media/E5pwV2bVIAAi82t.jpg', 'https://pbs.twimg.com/media/E5pwV2bVoAMOKf0.jpg', 'https://pbs.twimg.com/media/E5pwV2cVgAAeyDa.jpg']",0,1,4,[],[],https://twitter.com/DONDELI/status/1412564969376284673,False,,1,https://pbs.twimg.com/media/E5pwV2bUYAEfKnO.jpg,,,,,,,[],,,,
1412563493753028608,1412563493753028608,2021-07-07 00:05:55 UTC,2021-07-07,00:05:55,+0000,50255275,dondeli,DELI,,日本産業衛生学会　産業衛生技術部会 - 新型コロナウイルス感染予防対策用換気シミュレーター  https://t.co/3cBdzD2Gn0,ja,[],['http://jsoh-ohe.umin.jp/covid_simulator/covid_simulator.html'],[],1,6,9,[],[],https://twitter.com/DONDELI/status/1412563493753028608,False,,0,,,,,,,,[],,,,
