id,conversation_id,created_at,date,time,timezone,user_id,username,name,place,tweet,language,mentions,urls,photos,replies_count,retweets_count,likes_count,hashtags,cashtags,link,retweet,quote_url,video,thumbnail,near,geo,source,user_rt_id,user_rt,retweet_id,reply_to,retweet_date,translate,trans_src,trans_dest
1411162348488839169,1411162348488839169,2021-07-03 03:18:16 UTC,2021-07-03,03:18:16,+0000,1306192964,gannsun,gannsun,,大谷翔平２打席連続３０号　松井秀喜以来１７年ぶり２人目の大台突破(デイリースポーツ) #Yahooニュース  https://t.co/a5hr7kC2od,ja,[],['https://news.yahoo.co.jp/articles/953fa7f6b3cb7f7cb56197e8d0d03ee8a0803e79'],[],7,3,73,['yahooニュース'],[],https://twitter.com/gannsun/status/1411162348488839169,False,,0,,,,,,,,[],,,,
1407899070790656002,1407899070790656002,2021-06-24 03:11:10 UTC,2021-06-24,03:11:10,+0000,1306192964,gannsun,gannsun,,「失敗」って何！  一言で表すなら成功していないもの  でも、失敗にも色々とある。  積極的な失敗。成功へもう一歩の失敗。  成功へは程遠い失敗・・。  いずれにしても、失敗は「挑戦した証」  挑戦しないと失敗しない。  見守る人（親・先生・先輩・上司）も  失敗の中身（プラス面）を見て欲しい。,ja,[],[],[],7,8,168,[],[],https://twitter.com/gannsun/status/1407899070790656002,False,,0,,,,,,,,[],,,,
1405727821691904011,1405727821691904011,2021-06-18 03:23:24 UTC,2021-06-18,03:23:24,+0000,1306192964,gannsun,gannsun,,コロナ禍で「仕事が自由に出来ない時代」  仕事を変える人、  本業から「副業」へ軸足を移す人様々  もし、変わると決断したら  失敗を恐れずに種をまきましょう！  種を多くまいた人に、神様は多くの芽を  花をプレゼントしてくれるでしょう  そしてそれはいつか笑顔があふれる「福業」と  なります。,ja,[],[],[],11,15,190,[],[],https://twitter.com/gannsun/status/1405727821691904011,False,,0,,,,,,,,[],,,,
1404389617348972548,1404389617348972548,2021-06-14 10:45:51 UTC,2021-06-14,10:45:51,+0000,1306192964,gannsun,gannsun,,「不採用が成功！？」  一般的には不採用は失敗ですが、 時としてそうではない事例も  今日、朝から宅トレYouTuber 竹脇まりなさんのVで運動  主婦には有名な彼女。某番組で知った トレーナーの採用試験に落ち続けた過去が  そこから宅トレYouTuberへの道が そう、不採用こそが成功につながるのです！,ja,[],[],[],13,3,109,[],[],https://twitter.com/gannsun/status/1404389617348972548,False,,0,,,,,,,,[],,,,
1401485235276050438,1401485235276050438,2021-06-06 10:24:53 UTC,2021-06-06,10:24:53,+0000,1306192964,gannsun,gannsun,,「疲れた」という言葉。  会社人を卒業すると同時に発しなくなった言葉  その言葉は、周りの人たち（家族や同僚等）にも  ダメージを与える  そして勿論、自分の身体や心をも壊す。  もし、言わないと思って生きていても  ふと「疲れた・・」が出たら  「でも心地よい疲れ」など前向きな言葉でつなぐ。,ja,[],[],[],21,19,228,[],[],https://twitter.com/gannsun/status/1401485235276050438,False,,0,,,,,,,,[],,,,
1395568266572042241,1395568266572042241,2021-05-21 02:32:57 UTC,2021-05-21,02:32:57,+0000,1306192964,gannsun,gannsun,,建設工事の音が昼休みでやむ。  訪れる静寂音。静かな状態の有難さ・・。  静かな状態だけでは、静かな事に有難さを  感じられ（見い出せ）ない。  病気になる。病気から快復してはじめて  健康である事の「ありがたさ」を知る  不幸があり、幸を知る  不便があり、便を知る  不快があり、快を知る。,ja,[],[],[],14,16,232,[],[],https://twitter.com/gannsun/status/1395568266572042241,False,,0,,,,,,,,[],,,,
1394917234594648069,1394917234594648069,2021-05-19 07:25:59 UTC,2021-05-19,07:25:59,+0000,1306192964,gannsun,gannsun,,俳優・歌手の星野源と 女優の新垣結衣が結婚！  まじか（　＾ω＾）・・・。,ja,[],[],[],8,4,159,[],[],https://twitter.com/gannsun/status/1394917234594648069,False,,0,,,,,,,,[],,,,
1392753784544108552,1392753784544108552,2021-05-13 08:09:13 UTC,2021-05-13,08:09:13,+0000,1306192964,gannsun,gannsun,,「ピンチはチャンス」という言葉。  ピンチの中にもチャンスがあるニュアンス。  必ずしもチャンスにはならない。  「ピンチがチャンス」という言葉。  ピンチこそ絶好のチャンスという感じ。  本当に実力のある人、企業が力を出せる。  今、コロナ禍・・。  「ピンチがチャンス」で、乗り越えていく。,ja,[],[],[],5,12,244,[],[],https://twitter.com/gannsun/status/1392753784544108552,False,,0,,,,,,,,[],,,,
1389214144151232514,1389214144151232514,2021-05-03 13:43:56 UTC,2021-05-03,13:43:56,+0000,1306192964,gannsun,gannsun,,「笑顔」の伝染、怒りの伝染・・。  人間だから失敗する。 そして不機嫌にも・・  不機嫌になって、怒って・・周りにも その嫌な空気をまき散らす。  その空気は最終的に、自分に返る。  だから、失敗しても不機嫌は最小にして （心の中だけにして）  次に笑顔でのぞむ。  「笑顔は、笑顔を生む。」,ja,[],[],[],6,25,242,[],[],https://twitter.com/gannsun/status/1389214144151232514,False,,0,,,,,,,,[],,,,
1385070795035078660,1385070795035078660,2021-04-22 03:19:45 UTC,2021-04-22,03:19:45,+0000,1306192964,gannsun,gannsun,,蝶は、花🌼や蜜があるから お花畑へ向かう  今、緊急事態宣言が再び出される  コロナ禍の人を蝶、娯楽スポットを お花畑と例えると  お花畑をなくなると、蝶が来なくなる という仕組み  百貨店、各種遊戯・遊技場が飲食店 同様に 休業にするのは、  人の流れ（人流）を無くす為に 必要という理論か！？,ja,[],[],[],4,15,182,[],[],https://twitter.com/gannsun/status/1385070795035078660,False,,0,,,,,,,,[],,,,
1381806499500974080,1381806499500974080,2021-04-13 03:08:36 UTC,2021-04-13,03:08:36,+0000,1306192964,gannsun,gannsun,,相手の事を感じる、少し助ける・・  新入社員（後輩）が入ってきましたか？  大丈夫？と聞いても、返事は「大丈夫です。」  「その大丈夫・・、（先輩忙しそうなので） 大丈夫！？」ではありませんか？  表情、態度から困っていないか？ 悩んで、苦しんでいないか？  を感じ取る。大変な事になる前に。,ja,[],[],[],12,17,273,[],[],https://twitter.com/gannsun/status/1381806499500974080,False,,0,,,,,,,,[],,,,
1381421250170343425,1381421250170343425,2021-04-12 01:37:46 UTC,2021-04-12,01:37:46,+0000,1306192964,gannsun,gannsun,,松山英樹選手がマスターズ優勝 おめでとうございます。感動をありがとう！ （４日間ずつと祈りながらみてました）  松山選手が今回凄いなと思えたのは 喜怒哀楽の波が少なくプレーしてました  悪い結果にも腐らず怒らず 良い結果にも大きく騒がず  冷静に周りの人にも笑顔を忘れず！ 気配りも忘れず！,ja,[],[],[],21,7,178,[],[],https://twitter.com/gannsun/status/1381421250170343425,False,,0,,,,,,,,[],,,,
1381105804284076036,1381105804284076036,2021-04-11 04:44:18 UTC,2021-04-11,04:44:18,+0000,1306192964,gannsun,gannsun,,巨人・岡本和に待望の今季１号！開幕から１５試合目、原監督もニヤリ(デイリースポーツ) #Yahooニュース  https://t.co/oSNVtIL1CB,ja,[],['https://news.yahoo.co.jp/articles/8871635edd1c79e8faf637d129621b146a1f8abe'],[],4,4,57,['yahooニュース'],[],https://twitter.com/gannsun/status/1381105804284076036,False,,0,,,,,,,,[],,,,
1376774958576103430,1376774958576103430,2021-03-30 05:55:04 UTC,2021-03-30,05:55:04,+0000,1306192964,gannsun,gannsun,,損害保険調査を数万件行った鑑定人が  自動車事故を起こさなかったのは  「偶々（たまたま）」と表現した。  今回のコロナでも今まで感染しなかった  のは「偶々」。いつ感染するかわからない。  唯一、感染の可能性を減らせるとしたら  人と会う事、集まりに参加する事を極力  無くす事だと思う。,ja,[],[],[],3,16,207,[],[],https://twitter.com/gannsun/status/1376774958576103430,False,,0,,,,,,,,[],,,,
1369845756035657730,1369845756035657730,2021-03-11 03:00:53 UTC,2021-03-11,03:00:53,+0000,1306192964,gannsun,gannsun,,東日本大震災から１０年。あれから１０年が 経過した。  政府主催の追悼式が開かれる。  時間：同日の「午後２時４６分」  それぞれの場所において「黙とう」のお願い  亡くなれた人に哀悼の意をささげよう。   #あれから10年,ja,[],[],[],6,16,292,['あれから10年'],[],https://twitter.com/gannsun/status/1369845756035657730,False,,0,,,,,,,,[],,,,
1365127378565963776,1365127378565963776,2021-02-26 02:31:44 UTC,2021-02-26,02:31:44,+0000,1306192964,gannsun,gannsun,,ひな祭りの人形と・・・  宮崎に旅行した際に土産として購入した  土偶の人形。  「ゆっくりステイホーム」で  おうち時間を楽しむ・・。  https://t.co/b6bFAWFAuG,ja,[],[],['https://pbs.twimg.com/media/EvHnUATVkAMKh_V.jpg'],13,21,327,[],[],https://twitter.com/gannsun/status/1365127378565963776,False,,1,https://pbs.twimg.com/media/EvHnUATVkAMKh_V.jpg,,,,,,,[],,,,
1361193799385370626,1361193799385370626,2021-02-15 06:01:06 UTC,2021-02-15,06:01:06,+0000,1306192964,gannsun,gannsun,,思いやりの心を持って・・  相手の事、家族の事を考えたら 感染リスクも考慮して  人の集まりを作らない、参加を呼びかけない 参加しない  感染が少なくなるなら、二重マスクも時にする  重傷者・自宅療養者はまだまだ多いから  医療従事者の負担を考え 感染しない行動を続ける。花見や行事も見送る,ja,[],[],[],7,24,321,[],[],https://twitter.com/gannsun/status/1361193799385370626,False,,0,,,,,,,,[],,,,
1358714478578180098,1358714478578180098,2021-02-08 09:49:10 UTC,2021-02-08,09:49:10,+0000,1306192964,gannsun,gannsun,,今、混沌とした日々が続きます。  思う様に仕事が出来ず、  また新しい仕事が得られない事も・・  新しいチャレンジ、転職・就職等をする時  自分と向き合う時間を持つ事をおすすめします  「そこで行う事は、やりきる覚悟を持つ事」  「自分はそれが出来ると信じられば、  幸せは必ず来ます。必進！」,ja,[],[],[],5,17,276,[],[],https://twitter.com/gannsun/status/1358714478578180098,False,,0,,,,,,,,[],,,,
1356146629103902730,1356146629103902730,2021-02-01 07:45:27 UTC,2021-02-01,07:45:27,+0000,1306192964,gannsun,gannsun,,「もう少し辛抱して・・」  コロナ禍で人と会わないで過ごすのは  正直辛い。  それでも、この国を新型コロナでまん延  させたくないので・・。  私は、もう一ケ月「ステイホーム」を行う  ※我が家のクーとガー（クワガタムシの雌）  も冬ごもり（冬眠）中。  暖かい春・夏はもう少しでやってくる！  https://t.co/cFNeMAgdsc,ja,[],[],['https://pbs.twimg.com/media/EtIADCvUcAMBQu2.jpg'],10,18,276,[],[],https://twitter.com/gannsun/status/1356146629103902730,False,,1,https://pbs.twimg.com/media/EtIADCvUcAMBQu2.jpg,,,,,,,[],,,,
1352546903003602945,1352546903003602945,2021-01-22 09:21:25 UTC,2021-01-22,09:21:25,+0000,1306192964,gannsun,gannsun,,コロナ禍では・・・今まで通りにいかない  事が、実に多い。  常識だった事が、非常識に・・  当たり前だった事が、当たり前でなくなる。  だから、「俯瞰的に」人生を見直す事が大事かも。  仕事、住む場所、人生設計、考え方等・・  変えてみれば、少し自由に生きられるかも  しれない。貴方は・・？,ja,[],[],[],7,14,241,[],[],https://twitter.com/gannsun/status/1352546903003602945,False,,0,,,,,,,,[],,,,
