id,conversation_id,created_at,date,time,timezone,user_id,username,name,place,tweet,language,mentions,urls,photos,replies_count,retweets_count,likes_count,hashtags,cashtags,link,retweet,quote_url,video,thumbnail,near,geo,source,user_rt_id,user_rt,retweet_id,reply_to,retweet_date,translate,trans_src,trans_dest
707759214983184386,707759214983184386,2016-03-10 02:45:21 UTC,2016-03-10,02:45:21,+0000,2231314800,gbf_vee,gbf_vee@グランブルーファンタジー,,今日からゲームに関する情報は グラブル公式アカウント( @granbluefantasy )から発信していくぜ！これからもグランブルーファンタジーをよろしくな！ #グラブル,ja,"[{'screen_name': 'granbluefantasy', 'name': 'グランブルーファンタジー', 'id': '1549889018'}]",[],[],13,315,106,['グラブル'],[],https://twitter.com/gbf_vee/status/707759214983184386,False,,0,,,,,,,,[],,,,
632160741932449792,632160741932449792,2015-08-14 12:04:00 UTC,2015-08-14,12:04:00,+0000,2231314800,gbf_vee,gbf_vee@グランブルーファンタジー,,ゼタがド派手な水着で登場だ！ 最初は全然着替えねぇんでのんびりするのが嫌なのかと思ったらデザインが気に食わなかっただけみてぇだ！ 新しい水着は気に入ったみてぇでよかったじゃねえか！ やっぱり赤い姉ちゃんは水着も赤なんだな！ #グラブル  http://t.co/jaBpw3ojbs,ja,[],[],['https://pbs.twimg.com/media/CMXi17GUYAAhP96.jpg'],39,394,364,['グラブル'],[],https://twitter.com/gbf_vee/status/632160741932449792,False,,1,https://pbs.twimg.com/media/CMXi17GUYAAhP96.jpg,,,,,,,[],,,,
632160679110180864,632160679110180864,2015-08-14 12:03:45 UTC,2015-08-14,12:03:45,+0000,2231314800,gbf_vee,gbf_vee@グランブルーファンタジー,,スフラマールセンセェがバカンスの装いで登場だ！ 寒い所の生まれだから暑いの苦手なんじゃねえかと心配したけど、海辺でもセンセェはセンセェだったぜ！ 早速オイラにも魔法のレッスン頼むぜぇ！ #グラブル  http://t.co/x7n9HAIIWS,ja,[],[],['https://pbs.twimg.com/media/CMXiyRcUYAA6uXz.jpg'],1,81,88,['グラブル'],[],https://twitter.com/gbf_vee/status/632160679110180864,False,,1,https://pbs.twimg.com/media/CMXiyRcUYAA6uXz.jpg,,,,,,,[],,,,
629594255586033664,629594255586033664,2015-08-07 10:05:42 UTC,2015-08-07,10:05:42,+0000,2231314800,gbf_vee,gbf_vee@グランブルーファンタジー,,ダヌアが水着に着替えたぜぇ！ 初めて見た「浮き輪」が気にいったみてーで、それで遊ぶために必死だぜ！ くらげやらカニやら、海の生き物たちに興味津々ですげぇ楽しそうでよかったぜぇ。 #グラブル  http://t.co/HEZDYnEwgx,ja,[],[],['https://pbs.twimg.com/media/CLzEowkUsAABvIj.jpg'],3,352,308,['グラブル'],[],https://twitter.com/gbf_vee/status/629594255586033664,False,,1,https://pbs.twimg.com/media/CLzEowkUsAABvIj.jpg,,,,,,,[],,,,
629594202645487617,629594202645487617,2015-08-07 10:05:29 UTC,2015-08-07,10:05:29,+0000,2231314800,gbf_vee,gbf_vee@グランブルーファンタジー,,リーシャが水着で登場だ！ よろず屋に頼んで水着を都合してもらったみてえだな！ いつもビシッとした雰囲気だったからか、水着をつけるのをためらってたけど、なかなか似合ってるじゃねえか！ どうやらビーチバレーに挑むみてぇだが…… #グラブル  http://t.co/MboxNTgDA0,ja,[],[],['https://pbs.twimg.com/media/CLzElqtVAAAYNZm.jpg'],1,309,264,['グラブル'],[],https://twitter.com/gbf_vee/status/629594202645487617,False,,1,https://pbs.twimg.com/media/CLzElqtVAAAYNZm.jpg,,,,,,,[],,,,
629594140855025664,629594140855025664,2015-08-07 10:05:15 UTC,2015-08-07,10:05:15,+0000,2231314800,gbf_vee,gbf_vee@グランブルーファンタジー,,今日からイベント「西白の戦い ～四象降臨～」が開催中だ！ 「四象の輝き」をあつめて色んなアイテムと交換して戦力を増強しようぜ！ 今回は救援の参戦タイミングでステータスや輝きの入手量にボーナスがつくようになっているぜ！ #グラブル  http://t.co/UEhBe0ukQj,ja,[],[],['https://pbs.twimg.com/media/CLzEiFcUkAAkBAL.jpg'],0,30,17,['グラブル'],[],https://twitter.com/gbf_vee/status/629594140855025664,False,,1,https://pbs.twimg.com/media/CLzEiFcUkAAkBAL.jpg,,,,,,,[],,,,
627071108768923648,627071108768923648,2015-07-31 10:59:37 UTC,2015-07-31,10:59:37,+0000,2231314800,gbf_vee,gbf_vee@グランブルーファンタジー,,ヴィーラが水着姿で登場だ！ よろず屋に頼まれてみんなと一緒に海の家でバイトすることになったんだが、どうも様子がおかしいんだよなぁ。 今回はイベント「薫風、白波を蹴立てる」にも登場だ！ヴィーラの意外な一面が見られるかもなぁ！ #グラブル  http://t.co/5YOCccjflm,ja,[],[],['https://pbs.twimg.com/media/CLPN2SYUAAA1K9j.jpg'],0,221,215,['グラブル'],[],https://twitter.com/gbf_vee/status/627071108768923648,False,,1,https://pbs.twimg.com/media/CLPN2SYUAAA1K9j.jpg,,,,,,,[],,,,
627071028263399424,627071028263399424,2015-07-31 10:59:18 UTC,2015-07-31,10:59:18,+0000,2231314800,gbf_vee,gbf_vee@グランブルーファンタジー,,なげぇ木の板を持って海から上がってきたのは、オイゲンだ！ アウギュステ生まれのオイゲンは、昔っから波乗りして遊んでたみてーで、すっげぇサマになってんだよなぁ！ オイラ、そんな遊びがあるなんてはじめて知ったぜぇ。 #グラブル  http://t.co/nLlgVaMHUE,ja,[],[],['https://pbs.twimg.com/media/CLPNxmUUMAAR_zZ.jpg'],0,102,93,['グラブル'],[],https://twitter.com/gbf_vee/status/627071028263399424,False,,1,https://pbs.twimg.com/media/CLPNxmUUMAAR_zZ.jpg,,,,,,,[],,,,
627070968549085184,627070968549085184,2015-07-31 10:59:03 UTC,2015-07-31,10:59:03,+0000,2231314800,gbf_vee,gbf_vee@グランブルーファンタジー,,ローアインにトモイにエルセム、騒がしい三人組が帰ってきやがったぜぇ！ 海の家で料理の手伝いをしながら空いた時間で遊びに行ったりして夏を満喫してて、なんつーかちゃっかりしてるよな！ 姐さんとの恋の行方は…どうなるんだろなぁ。 #グラブル  http://t.co/0mpaHhDFk1,ja,[],[],['https://pbs.twimg.com/media/CLPNuHvUkAAdaX8.jpg'],0,146,112,['グラブル'],[],https://twitter.com/gbf_vee/status/627070968549085184,False,,1,https://pbs.twimg.com/media/CLPNuHvUkAAdaX8.jpg,,,,,,,[],,,,
627070909916917760,627070909916917760,2015-07-31 10:58:49 UTC,2015-07-31,10:58:49,+0000,2231314800,gbf_vee,gbf_vee@グランブルーファンタジー,,この侍みてぇな恰好の兄ちゃんは「ジン」だ！ 「砂神の巫女」で一緒に戦った仲間だったが、アウギュステのビーチで久々に再会したんだぜ！ イベント「薫風、白波を蹴立てる」に参加するだけで仲間になるから、チェックしてみてくれよな！ #グラブル  http://t.co/S4wHeS2PdX,ja,[],[],['https://pbs.twimg.com/media/CLPNqtYUsAQOoUQ.jpg'],0,75,54,['グラブル'],[],https://twitter.com/gbf_vee/status/627070909916917760,False,,1,https://pbs.twimg.com/media/CLPNqtYUsAQOoUQ.jpg,,,,,,,[],,,,
627058736339640320,627058736339640320,2015-07-31 10:10:27 UTC,2015-07-31,10:10:27,+0000,2231314800,gbf_vee,gbf_vee@グランブルーファンタジー,,今日からイベント「薫風、白波を蹴立てる」が開催中だぜ！ ジンをはじめとして、オイゲン、ソリッズ、ヴィーラにローアイン、そしてターニャ達まで、大勢の仲間たちが登場するんだぜ！ 賑やかで楽しいと思うから、見てみてくれよな！ #グラブル  http://t.co/oCoPGpl5UY,ja,[],[],['https://pbs.twimg.com/media/CLPCmGsVAAIhQci.jpg'],0,64,27,['グラブル'],[],https://twitter.com/gbf_vee/status/627058736339640320,False,,1,https://pbs.twimg.com/media/CLPCmGsVAAIhQci.jpg,,,,,,,[],,,,
626334720704425984,626334720704425984,2015-07-29 10:13:28 UTC,2015-07-29,10:13:28,+0000,2231314800,gbf_vee,gbf_vee@グランブルーファンタジー,,カタリナの姐さんが新調した鎧で颯爽登場だ！ 前のはちょっと無骨な印象だったけど今度のは身軽な感じでいいじゃねえか！ なんでもこいつはルリアが選んでくれたってんで、姐さんの気合の入り方も違うぜ！ バトルでの活躍にも注目だな！ #グラブル  http://t.co/MjSjI0qk4X,ja,[],[],['https://pbs.twimg.com/media/CLEwG27UkAAUjW0.jpg'],1,126,95,['グラブル'],[],https://twitter.com/gbf_vee/status/626334720704425984,False,,1,https://pbs.twimg.com/media/CLEwG27UkAAUjW0.jpg,,,,,,,[],,,,
620903832432717824,620903832432717824,2015-07-14 10:33:04 UTC,2015-07-14,10:33:04,+0000,2231314800,gbf_vee,gbf_vee@グランブルーファンタジー,,この元気そうなドラフの爺さんは「古今独歩の大拳豪 ガンダゴウザ」だ！ 拳一つあれば何でもできるってのが持論の、伝説的格闘家なんだぜ！ 一撃必殺で神サマすらも倒しちまうことが人生の最終目標っつートンでもねぇ爺さんだ！ #グラブル  http://t.co/wLmZ4kxhrR,ja,[],[],['https://pbs.twimg.com/media/CJ3kvjWUYAAvDEj.jpg'],0,379,118,['グラブル'],[],https://twitter.com/gbf_vee/status/620903832432717824,False,,1,https://pbs.twimg.com/media/CJ3kvjWUYAAvDEj.jpg,,,,,,,[],,,,
620903774106681344,620903774106681344,2015-07-14 10:32:50 UTC,2015-07-14,10:32:50,+0000,2231314800,gbf_vee,gbf_vee@グランブルーファンタジー,,エルモートが涼しげな恰好で登場だ！ 火の扱いに長けてることを生かして、海の家で厨房を手伝うことになったみてえだ！ 焼き加減にこだわって作った『炎獄焼き』は、たちまち行列が出来るくらいの美味さだぜぇ！ #グラブル  http://t.co/MCtayReNum,ja,[],[],['https://pbs.twimg.com/media/CJ3ksKjUwAAM4ua.jpg'],0,199,181,['グラブル'],[],https://twitter.com/gbf_vee/status/620903774106681344,False,,1,https://pbs.twimg.com/media/CJ3ksKjUwAAM4ua.jpg,,,,,,,[],,,,
620903713478066176,620903713478066176,2015-07-14 10:32:35 UTC,2015-07-14,10:32:35,+0000,2231314800,gbf_vee,gbf_vee@グランブルーファンタジー,,ターニャが夏の装いで登場だ！ よろず屋の頼みで海の家を手伝うことになったぜ！ 口下手で接客業は苦手だって戸惑ってたんだが、ターニャの意外な一面が活かされてなかなかうまくやってるみてぇだ！ #グラブル  http://t.co/ijQQRZNQ8W,ja,[],[],['https://pbs.twimg.com/media/CJ3koogUEAE-QIM.jpg'],0,232,206,['グラブル'],[],https://twitter.com/gbf_vee/status/620903713478066176,False,,1,https://pbs.twimg.com/media/CJ3koogUEAE-QIM.jpg,,,,,,,[],,,,
615883805971185664,615883805971185664,2015-06-30 14:05:16 UTC,2015-06-30,14:05:16,+0000,2231314800,gbf_vee,gbf_vee@グランブルーファンタジー,,このミステリアスな雰囲気の姉ちゃんは「アーミラ」だ！ ヘルヘイム、っていう名前の土地を探してるみてーだが、誰も聞いたことねぇんだよなぁ。 しかしどうやら、それと関係あるかわかんねぇが、スゲェ力を持ってるようだぜ！ #グラブル  http://t.co/zorQdBSRuv,ja,[],[],['https://pbs.twimg.com/media/CIwPDj2VAAA3DQU.jpg'],0,115,108,['グラブル'],[],https://twitter.com/gbf_vee/status/615883805971185664,False,,1,https://pbs.twimg.com/media/CIwPDj2VAAA3DQU.jpg,,,,,,,[],,,,
615883726690480128,615883726690480128,2015-06-30 14:04:57 UTC,2015-06-30,14:04:57,+0000,2231314800,gbf_vee,gbf_vee@グランブルーファンタジー,,この鋼の機械兵は「ロボミ」ってんだ！ 古代の地層から発掘された鋼の像が動き出したワケなんだが、これがオーパーツ？ってヤツなのかなぁ？ イベント「ロボミ」に参加して、コイツと一緒に壊獣達を蹴散らそうぜ！ #グラブル  http://t.co/ZQKltIY40G,ja,[],[],['https://pbs.twimg.com/media/CIwO-8UUYAAqsiA.jpg'],0,65,45,['グラブル'],[],https://twitter.com/gbf_vee/status/615883726690480128,False,,1,https://pbs.twimg.com/media/CIwO-8UUYAAqsiA.jpg,,,,,,,[],,,,
615883663327145984,615883663327145984,2015-06-30 14:04:42 UTC,2015-06-30,14:04:42,+0000,2231314800,gbf_vee,gbf_vee@グランブルーファンタジー,,あのフェザーが旅を経て、パワーアップして再登場だぜぇ！ コイツが目標としている「求道者」ってぇ男がいるみてーなんだが、どうやらそいつの手掛かりを得たようだぜ！ そいつもフェザーみたいに暑苦しいヤツだったりすんのかな？ #グラブル  http://t.co/uvtFwZ2IvQ,ja,[],[],['https://pbs.twimg.com/media/CIwO7QQVEAEYGKm.jpg'],1,131,110,['グラブル'],[],https://twitter.com/gbf_vee/status/615883663327145984,False,,1,https://pbs.twimg.com/media/CIwO7QQVEAEYGKm.jpg,,,,,,,[],,,,
615883592506343424,615883592506343424,2015-06-30 14:04:25 UTC,2015-06-30,14:04:25,+0000,2231314800,gbf_vee,gbf_vee@グランブルーファンタジー,,このサッパリした兄ちゃんは「ジョエル」だ！ アウギュステの観光地で、海の監視員の仕事をしてる真面目なヤツだ！ 空の底には大海があるっておとぎ話に憧れてて、いつかそこで思いっきり泳ぐことが夢なんだってさ！ #グラブル  http://t.co/P5pf4JXVyH,ja,[],[],['https://pbs.twimg.com/media/CIwO3IhUkAIqNw7.jpg'],0,95,95,['グラブル'],[],https://twitter.com/gbf_vee/status/615883592506343424,False,,1,https://pbs.twimg.com/media/CIwO3IhUkAIqNw7.jpg,,,,,,,[],,,,
614376238325460993,614376238325460993,2015-06-26 10:14:44 UTC,2015-06-26,10:14:44,+0000,2231314800,gbf_vee,gbf_vee@グランブルーファンタジー,,この不敵な感じの兄ちゃんは「パーシヴァル」だ！ オイラ達を家臣にしてやるとか言ってて、なんだか王様みてぇに偉そうな態度してるけど、弱いものを助けられる国作りを本気で目指してるイイやつみてぇだ！ フェードラッヘ出身らしいぜ！ #グラブル  http://t.co/mCgPjQ37Wj,ja,[],[],['https://pbs.twimg.com/media/CIaz7kTUsAAbs1g.jpg'],0,442,419,['グラブル'],[],https://twitter.com/gbf_vee/status/614376238325460993,False,,1,https://pbs.twimg.com/media/CIaz7kTUsAAbs1g.jpg,,,,,,,[],,,,
