id,conversation_id,created_at,date,time,timezone,user_id,username,name,place,tweet,language,mentions,urls,photos,replies_count,retweets_count,likes_count,hashtags,cashtags,link,retweet,quote_url,video,thumbnail,near,geo,source,user_rt_id,user_rt,retweet_id,reply_to,retweet_date,translate,trans_src,trans_dest
1398905174790336516,1398905174790336516,2021-05-30 07:32:38 UTC,2021-05-30,07:32:38,+0000,165530328,llve_jp,デジタル,,不織布マスクの効果について 口を開けた状態のマネキン2体に 不織布マスクを付けて 1体は感染もう1体は非感染の状態で 本物のコロナウイルスを使って 1メートル離れたクリアケースに入れて実験した結果。 ウイルスの予防率は50%の結果が出ました。,ja,[],[],[],2,0,14,[],[],https://twitter.com/LlVE_jp/status/1398905174790336516,False,,0,,,,,,,,[],,,,
1395749748796100608,1395749748796100608,2021-05-21 14:34:06 UTC,2021-05-21,14:34:06,+0000,165530328,llve_jp,デジタル,,メインの電話が携帯電話になったせいか最近 家の固定電話にはセールスの電話しか かかって来ない,ja,[],[],[],0,0,6,[],[],https://twitter.com/LlVE_jp/status/1395749748796100608,False,,0,,,,,,,,[],,,,
1365513711985647617,1365513711985647617,2021-02-27 04:06:53 UTC,2021-02-27,04:06:53,+0000,165530328,llve_jp,デジタル,,消費者庁、賞味期限を「おいしいめやす」へ,ja,[],[],[],1,4,14,[],[],https://twitter.com/LlVE_jp/status/1365513711985647617,False,,0,,,,,,,,[],,,,
1365183054382161926,1365183054382161926,2021-02-26 06:12:58 UTC,2021-02-26,06:12:58,+0000,165530328,llve_jp,デジタル,,陸軍に指示できる人物は、かなりの大物。数々の陰謀説が渦巻くマフィア、ソ連が陸軍に指示できるかな？ 2021年10月にバイデン大統領が残りのCIA関連の機密文書を全面公開する  https://t.co/EkZASOqIME,ja,[],['https://twitter.com/LlVE_jp/status/1358778945613688833'],[],1,0,8,[],[],https://twitter.com/LlVE_jp/status/1365183054382161926,False,https://twitter.com/LlVE_jp/status/1358778945613688833,0,,,,,,,,[],,,,
1358778945613688833,1358778945613688833,2021-02-08 14:05:20 UTC,2021-02-08,14:05:20,+0000,165530328,llve_jp,デジタル,,"トランプ氏JFK暗殺の機密文書を公開するも新展開なし。不可解なのが暗殺当日『誰かの指示で』ヒューストンの第四軍司令部第112陸軍情報班が非番になっていて尚且つ,シークレットサービスの人員も数百人少なく警備がかなり手薄にライヒ大佐が抗議するも却下。一体 誰が指示を出したか追求されてなく不明",ja,[],[],[],0,2,5,[],[],https://twitter.com/LlVE_jp/status/1358778945613688833,False,,0,,,,,,,,[],,,,
1358778663764828164,1355599713668460544,2021-02-08 14:04:12 UTC,2021-02-08,14:04:12,+0000,165530328,llve_jp,デジタル,,"@pussycat_yuko トランプ氏JFK暗殺の機密文書を公開するも新展開なし。不可解なのが暗殺当日『誰かの指示で』ヒューストンの第四軍司令部第112陸軍情報班が非番になっていて尚且つ,シークレットサービスの人員も数百人少なく警備がかなり手薄にライヒ大佐が抗議するも却下。一体 誰が指示を出したか追求されてなく不明",ja,[],[],[],0,1,3,[],[],https://twitter.com/LlVE_jp/status/1358778663764828164,False,,0,,,,,,,,"[{'screen_name': 'pussycat_yuko', 'name': 'みなみのゆうこ', 'id': '131786555'}]",,,,
1355830224357781505,495191201142669312,2021-01-31 10:48:10 UTC,2021-01-31,10:48:10,+0000,165530328,llve_jp,デジタル,,携帯キャリア3社、今期の取り組みは? - 明暗分けた2013年度決算まとめ  https://t.co/9IHpAGjTtB,ja,[],['https://news.mynavi.jp/article/20140516-kessan/'],[],0,1,8,[],[],https://twitter.com/LlVE_jp/status/1355830224357781505,False,,0,,,,,,,,[],,,,
1355091817100832769,1355091817100832769,2021-01-29 09:54:00 UTC,2021-01-29,09:54:00,+0000,165530328,llve_jp,デジタル,,トランプ氏、ＪＦＫ暗殺の機密文書を２６日公開  https://t.co/AMDCN95Unf JFKは暗殺されて大統領が交代しましたが、時代は変わり、世界最大規模の不正選挙でアメリカ大統領が交代するJFK暗殺事件に告ぐ不可解な大統領交代。,ja,[],['https://www.cnn.co.jp/usa/35109392.html'],[],0,2,9,[],[],https://twitter.com/LlVE_jp/status/1355091817100832769,False,,0,,,,,,,,[],,,,
1349643190417068035,1349643190417068035,2021-01-14 09:03:06 UTC,2021-01-14,09:03:06,+0000,165530328,llve_jp,デジタル,,ペロシ議長がマーク・ミリー統合参謀本部議長に トランプ軍事オプション停止について軍部に打診.  軍部による見解。マーク・ミリーのスポークスマン、デイブバトラー大佐は ①トランプ大統領が解任されない限り軍の最高司令官である。 ②大統領を指揮から積極的に排除する行為は軍事クーデターとみなす,ja,[],[],[],1,2,12,[],[],https://twitter.com/LlVE_jp/status/1349643190417068035,False,,0,,,,,,,,[],,,,
1346878510846017536,1346878510846017536,2021-01-06 17:57:15 UTC,2021-01-06,17:57:15,+0000,165530328,llve_jp,デジタル,,ハイ出ました。ジョージア州上院議員選挙でもアメリカ大統領選挙と同じドミニオン集計機で バイデ ンジャンプ再び。ワシントンDC 大規模な集会  https://t.co/p68leuds2r,ja,[],[],['https://pbs.twimg.com/media/ErESzl1UUAE3Sjz.jpg'],0,0,16,[],[],https://twitter.com/LlVE_jp/status/1346878510846017536,False,,1,https://pbs.twimg.com/media/ErESzl1UUAE3Sjz.jpg,,,,,,,[],,,,
1326115716299329536,1326115716299329536,2020-11-10 10:53:19 UTC,2020-11-10,10:53:19,+0000,165530328,llve_jp,デジタル,,ミシガン州の47の町と、ジョージア州2の町からトランプの票が消える不正のソフトウェアが集票機に仕込まれていて、ミシガンの6000票が自動的にトランプからバイデンに変えてしまう、これをバイデンからトランプに戻すことになった。不正の証拠がなければ票を戻すことはないでしょう。,ja,[],[],[],0,3,17,[],[],https://twitter.com/LlVE_jp/status/1326115716299329536,False,,0,,,,,,,,[],,,,
1325323674790948864,1325323674790948864,2020-11-08 06:26:02 UTC,2020-11-08,06:26:02,+0000,165530328,llve_jp,デジタル,,11月4日残り7州 ウィスコンシン、ミシガンの投票数からほぼトランプ再選勝利確定。その日の夜開票が終り次の日の早朝集計開始前に、両方の州から同じ時間帯に民主党が未集計の票を発見し、両方ともバイデン票100%トランプ票ゼロ2州の票に突然追加され12万と13万票追加され奇跡のあり得ない逆転が起きた,ja,[],[],[],0,2,2,[],[],https://twitter.com/LlVE_jp/status/1325323674790948864,False,,0,,,,,,,,[],,,,
1324953235388428290,1324953235388428290,2020-11-07 05:54:02 UTC,2020-11-07,05:54:02,+0000,165530328,llve_jp,デジタル,,ディープインパクトは将来実際にあり得るシミュレーションの映画だそうです。,ja,[],[],[],1,0,2,[],[],https://twitter.com/LlVE_jp/status/1324953235388428290,False,,0,,,,,,,,[],,,,
1323847270215790593,1323847270215790593,2020-11-04 04:39:19 UTC,2020-11-04,04:39:19,+0000,165530328,llve_jp,デジタル,,トランプ再選の絶対条件はフロリダとペンシルベニア勝利らしいです。ペンシルベニア選挙人20人を取れなくても他のところが取れていれば可能性が残るらしい。,ja,[],[],[],0,1,6,[],[],https://twitter.com/LlVE_jp/status/1323847270215790593,False,,0,,,,,,,,[],,,,
1323791789732458497,1323791789732458497,2020-11-04 00:58:52 UTC,2020-11-04,00:58:52,+0000,165530328,llve_jp,デジタル,,トランプはフロリダで勝って選挙人29人取らなければ落選確定らしいです。 結果が出るのは今日の13時頃らしい。,ja,[],[],[],0,1,9,[],[],https://twitter.com/LlVE_jp/status/1323791789732458497,False,,0,,,,,,,,[],,,,
1299278017726836738,1299278017726836738,2020-08-28 09:29:53 UTC,2020-08-28,09:29:53,+0000,165530328,llve_jp,デジタル,,安倍辞任によって痛手を負うのは外交,ja,[],[],[],0,4,18,[],[],https://twitter.com/LlVE_jp/status/1299278017726836738,False,,0,,,,,,,,[],,,,
1288861659050553345,1288861659050553345,2020-07-30 15:39:00 UTC,2020-07-30,15:39:00,+0000,165530328,llve_jp,デジタル,,スパコン富岳を使ってロト6、ロト7の当選確率の計算で使いたい,ja,[],[],[],0,0,6,[],[],https://twitter.com/LlVE_jp/status/1288861659050553345,False,,0,,,,,,,,[],,,,
1281145874307932160,1281145874307932160,2020-07-09 08:39:13 UTC,2020-07-09,08:39:13,+0000,165530328,llve_jp,デジタル,,最近はめっきり暑くなり冬には自分が吐いた息が、たばこの煙のように見えていたのに最近は全く見えない。くしゃみや咳による飛沫に直接接触しなければ感染しないと思っている人もいる。無症状者の吐いた息のウイルスはその場所に浮遊している。 https://t.co/fJZ4vUyzHo,ja,[],['https://www.bbc.com/japanese/53330196'],[],0,0,11,[],[],https://twitter.com/LlVE_jp/status/1281145874307932160,False,,0,,,,,,,,[],,,,
1265875957350428672,1265875957350428672,2020-05-28 05:22:01 UTC,2020-05-28,05:22:01,+0000,165530328,llve_jp,デジタル,,マスク品薄解消、値下げ始まるも最近はドラッグストアでも 全国マスク工業会 会員安全マークのないマスクが売られている。 早く安全マークのあるマスクを手に入れたい。  https://t.co/xEUS87wR91,ja,[],[],['https://pbs.twimg.com/media/EZFLXsLVAAEufVC.jpg'],0,2,14,[],[],https://twitter.com/LlVE_jp/status/1265875957350428672,False,,1,https://pbs.twimg.com/media/EZFLXsLVAAEufVC.jpg,,,,,,,[],,,,
1253156909290385408,1253156909290385408,2020-04-23 03:01:04 UTC,2020-04-23,03:01:04,+0000,165530328,llve_jp,デジタル,,品薄マスク 転売禁止も 抜け穴。 都内では1箱400～1000円のものが3000～5000円というものが多数確認されている。 https://t.co/CROgSps5Z1,ja,[],['https://www.youtube.com/watch?v=PhtmLGSLH4k&feature=youtu.be&t=8m00s'],[],0,1,7,[],[],https://twitter.com/LlVE_jp/status/1253156909290385408,False,,0,,,,,,,,[],,,,
