id,conversation_id,created_at,date,time,timezone,user_id,username,name,place,tweet,language,mentions,urls,photos,replies_count,retweets_count,likes_count,hashtags,cashtags,link,retweet,quote_url,video,thumbnail,near,geo,source,user_rt_id,user_rt,retweet_id,reply_to,retweet_date,translate,trans_src,trans_dest
1413832336702013446,1413832336702013446,2021-07-10 12:07:51 UTC,2021-07-10,12:07:51,+0000,1495700766,shimashima108,✦しまりす卿✦(株),,"CLEAR GALLERY TOKYO行ってきました🙌 お会いできた方、嬉しかったです☺️  展示は17日まで六本木で行われているので、是非(* .ˬ.)""💕  追ってコメントが古賀さんのYouTubeチャンネルから公開されると思いますぅ〜✨  https://t.co/19KkkdSBew",ja,[],[],"['https://pbs.twimg.com/media/E57xAW2VoAYnPLP.jpg', 'https://pbs.twimg.com/media/E57xAW5VkAEQnLw.jpg', 'https://pbs.twimg.com/media/E57xAW3VkAAlV27.jpg', 'https://pbs.twimg.com/media/E57xAW9VkAYzY4F.jpg']",1,9,64,[],[],https://twitter.com/Shimashima108/status/1413832336702013446,False,,1,https://pbs.twimg.com/media/E57xAW2VoAYnPLP.jpg,,,,,,,[],,,,
1413681399136096256,1413681399136096256,2021-07-10 02:08:05 UTC,2021-07-10,02:08:05,+0000,1495700766,shimashima108,✦しまりす卿✦(株),,行きます、クリアギャラリー@六本木！  べんちょが私からくっついて離れなくなってます。ここは生前じょるのがよく座ってた場所。べんもここに来たかったんだね〜🐅  https://t.co/YIXm2rbCDa,ja,[],[],['https://pbs.twimg.com/media/E55nvC4VUAEbJxU.jpg'],6,1,52,[],[],https://twitter.com/Shimashima108/status/1413681399136096256,False,,1,https://pbs.twimg.com/media/E55nvC4VUAEbJxU.jpg,,,,,,,[],,,,
1412766244512563203,1412766244512563203,2021-07-07 13:31:35 UTC,2021-07-07,13:31:35,+0000,1495700766,shimashima108,✦しまりす卿✦(株),,YouTubeの配信は7月いっぱいはお休みします。メンバーシップの方、チェキをお送りするのがかなり遅れてしまいそうです。ごめんなさい。7月は限定配信も厳しいので解除頂いても大丈夫です。(再度登録した際に登録期間は引き継がれるようです。)  皆様と笑顔で話せるようになるまで、少し時間を下さい。,ja,[],[],[],4,0,33,[],[],https://twitter.com/Shimashima108/status/1412766244512563203,False,,0,,,,,,,,[],,,,
1412759395021123588,1412759395021123588,2021-07-07 13:04:22 UTC,2021-07-07,13:04:22,+0000,1495700766,shimashima108,✦しまりす卿✦(株),,現在行われている古賀さんの展示、JCTには今週10日(土)の昼頃に挨拶も兼ねて伺う予定です。 いつも通りの感じでお話出来るか分かりませんが、お時間合えば是非☺️,ja,[],[],[],0,8,29,[],[],https://twitter.com/Shimashima108/status/1412759395021123588,False,https://twitter.com/manabukoga/status/1407182213729316870,0,,,,,,,,[],,,,
1412759329850101765,1412759329850101765,2021-07-07 13:04:06 UTC,2021-07-07,13:04:06,+0000,1495700766,shimashima108,✦しまりす卿✦(株),,7/23に行われる大阪での撮影会は予定通り参加致します。  全力でご予約をお待ちしております🙇‍♀️,ja,[],[],[],1,5,34,[],[],https://twitter.com/Shimashima108/status/1412759329850101765,False,https://twitter.com/aimi_feti/status/1408400617844789249,0,,,,,,,,[],,,,
1412759157606739979,1412759157606739979,2021-07-07 13:03:25 UTC,2021-07-07,13:03:25,+0000,1495700766,shimashima108,✦しまりす卿✦(株),,ご報告  7月6日19:51 私の腕の中でじょるのが旅立ちました。  沢山の応援コメント、本当にありがとうございました。今は心が苦しいのでまた元気になったら色々とお話しさせて下さい。  しばらくの間はSNS、YouTubeはゆるい更新になると思います。,ja,[],[],[],25,4,93,[],[],https://twitter.com/Shimashima108/status/1412759157606739979,False,,0,,,,,,,,[],,,,
1411886814483271680,1411886814483271680,2021-07-05 03:17:02 UTC,2021-07-05,03:17:02,+0000,1495700766,shimashima108,✦しまりす卿✦(株),,いつもはデスクトップ作業ですが、今日はじょるのが寝たいという場所までノートパソコンを持ってきてお仕事💻  家の中で作業場所を変えるだけでも気分転換になると言う気づきを得ました😁  ちゃっかり邪魔までして来て、あと少しの時間しかないなんて全然考えられない見た目だゾ🐈‍⬛  https://t.co/SPZBa7XsqO,ja,[],[],['https://pbs.twimg.com/media/E5gHkuKVUAQjjLl.jpg'],5,7,67,[],[],https://twitter.com/Shimashima108/status/1411886814483271680,False,,1,https://pbs.twimg.com/media/E5gHkuKVUAQjjLl.jpg,,,,,,,[],,,,
1411837060378349569,1411837060378349569,2021-07-04 23:59:20 UTC,2021-07-04,23:59:20,+0000,1495700766,shimashima108,✦しまりす卿✦(株),,おはようございますッ 無事に夜を越えられたじょるのも一緒に🐈‍⬛おまんじゅうみたい☺️  https://t.co/zyU4iaTtnN,ja,[],[],['https://pbs.twimg.com/media/E5faUmnVcAAeu0K.jpg'],6,9,128,[],[],https://twitter.com/Shimashima108/status/1411837060378349569,False,,1,https://pbs.twimg.com/media/E5faUmnVcAAeu0K.jpg,,,,,,,[],,,,
1411657029828046848,1411655989938376711,2021-07-04 12:03:57 UTC,2021-07-04,12:03:57,+0000,1495700766,shimashima108,✦しまりす卿✦(株),,供血猫の呼び掛けに反応して下さった方、DMを下さった方、本当にありがとうございました。心が救われました。  じょるのの輸血はここでおしまいですが、皆様から頂いたじょるのへの応援のお言葉、今も心の支えになっています。  本当にありがとうございました。  これからじょるのは我儘三昧です🐈‍⬛,ja,[],[],[],3,5,45,[],[],https://twitter.com/Shimashima108/status/1411657029828046848,False,,0,,,,,,,,[],,,,
1411655989938376711,1411655989938376711,2021-07-04 11:59:49 UTC,2021-07-04,11:59:49,+0000,1495700766,shimashima108,✦しまりす卿✦(株),,昨日の輸血の結果を調べに午前中病院へ。中々厳しい状態でした。  ただ昨日輸血できてなかったら恐らく亡くなってしまっていたので、ドナー様が血をくれたお陰で色々と心の整理をする時間を作れました。 ここからは無理な治療、検査、投薬は行わず緩和ケアをしながら家でゆっくり過ごす事にしましす😌  https://t.co/8Ibf0HxxkN,ja,[],[],['https://pbs.twimg.com/media/E5c1o43VgAYJhms.jpg'],7,14,90,[],[],https://twitter.com/Shimashima108/status/1411655989938376711,False,,1,https://pbs.twimg.com/media/E5c1o43VgAYJhms.jpg,,,,,,,[],,,,
1411395896374222848,1411395896374222848,2021-07-03 18:46:18 UTC,2021-07-03,18:46:18,+0000,1495700766,shimashima108,✦しまりす卿✦(株),,きっと朝目覚めてくれるよね。 でも、無理はしないでね！って思いながら撫でてるずっと。  お膝で長い時間寝るなんて、赤ちゃんの時以来か初めての事かな？ゆっくり休むんだぞー😽,ja,[],[],[],4,2,50,[],[],https://twitter.com/Shimashima108/status/1411395896374222848,False,,0,,,,,,,,[],,,,
1411394651932676096,1411394651932676096,2021-07-03 18:41:22 UTC,2021-07-03,18:41:22,+0000,1495700766,shimashima108,✦しまりす卿✦(株),,お膝でスヤスヤ🥰💤大好きじょるの🐈‍⬛  ※べんぞうはケージで大爆睡🐅w  https://t.co/3kHltm9Skv,ja,[],[],['https://pbs.twimg.com/media/E5ZH8-2VkAYomFo.jpg'],3,5,55,[],[],https://twitter.com/Shimashima108/status/1411394651932676096,False,,1,https://pbs.twimg.com/media/E5ZH8-2VkAYomFo.jpg,,,,,,,[],,,,
1411333920143024134,1411331308366667776,2021-07-03 14:40:02 UTC,2021-07-03,14:40:02,+0000,1495700766,shimashima108,✦しまりす卿✦(株),,2人の写真が撮れました☺️  https://t.co/r4eyYeFWE6,ja,[],[],"['https://pbs.twimg.com/media/E5YQt_RVIAA7Csl.jpg', 'https://pbs.twimg.com/media/E5YQt_iVEAgWw77.jpg']",1,6,59,[],[],https://twitter.com/Shimashima108/status/1411333920143024134,False,,1,https://pbs.twimg.com/media/E5YQt_RVIAA7Csl.jpg,,,,,,,[],,,,
1411331308366667776,1411331308366667776,2021-07-03 14:29:39 UTC,2021-07-03,14:29:39,+0000,1495700766,shimashima108,✦しまりす卿✦(株),,本日、3回目の輸血を行いました。ドナーになって下さった方には感謝してもしきれません🥲 昨日時点で数値悪化していたので今朝は凄く不安でしたが、案の定危ない状態でした。輸血は無事に終えたので後はどこまで血を受け止められるか、です。  明日の検査で結果が分かります😖まずは今夜を乗り切ろうね  https://t.co/fSNYRIG6b8,ja,[],[],['https://pbs.twimg.com/media/E5YOV9VUUAYwqIi.jpg'],5,14,142,[],[],https://twitter.com/Shimashima108/status/1411331308366667776,False,,1,https://pbs.twimg.com/media/E5YOV9VUUAYwqIi.jpg,,,,,,,[],,,,
1410927197183832067,1410897873659568130,2021-07-02 11:43:52 UTC,2021-07-02,11:43:52,+0000,1495700766,shimashima108,✦しまりす卿✦(株),,@Similaires 出血と言っても外傷ではなく臓器(脾臓というスポンジ状の臓器)になるので、止血が困難な場所らしいです‥素人なので詳しい事は分からないのですが、セカンド、サードオピニオンでも3名に同じ事を言われてしまったので、厳しいんだと思います😢  癌‥辛かったですね‥薬初耳です‼️画像保存しました👍,ja,[],[],[],1,0,0,[],[],https://twitter.com/Shimashima108/status/1410927197183832067,False,,0,,,,,,,,"[{'screen_name': 'Similaires', 'name': 'Ｈ_Deuxieme', 'id': '138031830'}]",,,,
1410904020026228742,1410897873659568130,2021-07-02 10:11:46 UTC,2021-07-02,10:11:46,+0000,1495700766,shimashima108,✦しまりす卿✦(株),,@satumaimo_tea ここかも、と言う箇所の検査が針を刺して細胞を取る方法らしいんですが、貧血＆血小板の数値が低いので、刺した瞬間出血が止まらなくなり貧血で命を落とす可能性が高いとの事でした‥これに関しては現状輸血でどうにかなる問題ではないらしいです😢  特定が出来ないと根本治療が出来ず‥難しい所です‥,ja,[],[],[],2,0,1,[],[],https://twitter.com/Shimashima108/status/1410904020026228742,False,,0,,,,,,,,"[{'screen_name': 'satumaimo_tea', 'name': 'さつまいもティー', 'id': '2437086194'}]",,,,
1410897873659568130,1410897873659568130,2021-07-02 09:47:20 UTC,2021-07-02,09:47:20,+0000,1495700766,shimashima108,✦しまりす卿✦(株),,検査、終わりました。 大きな病院でも今は検査しきれない、と言われてしまい、ちょっと厳しい状態でした。取り急ぎご報告まで。詳しい事は追って  ドナーの方にお力添え頂く可能性は継続です🙇‍♀️  じょるのは疲れちゃったので、食後から寝てます。病院食が不味いらしく、べんのご飯を奪いに行ってました  https://t.co/xBVR2MpUZO,ja,[],[],['https://pbs.twimg.com/media/E5SEIsoVoAMECTt.jpg'],7,15,64,[],[],https://twitter.com/Shimashima108/status/1410897873659568130,False,,1,https://pbs.twimg.com/media/E5SEIsoVoAMECTt.jpg,,,,,,,[],,,,
1410795351720841225,1410795351720841225,2021-07-02 02:59:57 UTC,2021-07-02,02:59:57,+0000,1495700766,shimashima108,✦しまりす卿✦(株),,検査に送り出しました🐈‍⬛  一通り出来る検査をやって14時頃に結果が出るみたいです。その結果次第で次は何が出来るかを相談しましょうとの事でした🏥  病院待機です☕️,ja,[],[],[],4,7,38,[],[],https://twitter.com/Shimashima108/status/1410795351720841225,False,,0,,,,,,,,[],,,,
1410747408221229062,1410747408221229062,2021-07-01 23:49:27 UTC,2021-07-01,23:49:27,+0000,1495700766,shimashima108,✦しまりす卿✦(株),,おはようございます。  本日の検査において輸血が必要になった場合はご連絡下さっているドナーの方にご連絡させて頂くかもしれないです🙇‍♀️  予約は10:30〜。検査内容、結果や判断の時間は分かりかねてしまいます💦  じょるのは8時間の断食中で一通りニャーニャーと文句を言った後、拗ねて寝てます🐈‍⬛💤,ja,[],[],[],5,7,40,[],[],https://twitter.com/Shimashima108/status/1410747408221229062,False,,0,,,,,,,,[],,,,
1410659996073820161,1410659996073820161,2021-07-01 18:02:06 UTC,2021-07-01,18:02:06,+0000,1495700766,shimashima108,✦しまりす卿✦(株),,貧血の数値、今夜は大丈夫と言われても心配は心配なので、ずっとじょるのの呼吸数を数える夜。お腹が上下に動いてて、頑張って生きてくれてありがとうと言う気持ちになる🥲  明日は大きな病院の日。どんな診断になろうとじょるのの幸せを考え、最善の判断が出来たらと思います。  皆に励まされてます。,ja,[],[],[],4,5,46,[],[],https://twitter.com/Shimashima108/status/1410659996073820161,False,,0,,,,,,,,[],,,,
