id,conversation_id,created_at,date,time,timezone,user_id,username,name,place,tweet,language,mentions,urls,photos,replies_count,retweets_count,likes_count,hashtags,cashtags,link,retweet,quote_url,video,thumbnail,near,geo,source,user_rt_id,user_rt,retweet_id,reply_to,retweet_date,translate,trans_src,trans_dest
1413379580073693184,1413379580073693184,2021-07-09 06:08:45 UTC,2021-07-09,06:08:45,+0000,171793885,toyamakoichi,外山恒一,,結果として妙に私の株が上がった鼎談？であった（笑）。“過激な活動家”のイメージと違う！的な感想も多かったが、そんなもん、必死で仲間割れを止めなきゃならないような場面なんか活動の現場ではいくらでもあって、それこそ“過激な活動家”同士の喧嘩を止めることに比べたら何ほどのこともないですよ。,ja,[],[],[],0,35,118,[],[],https://twitter.com/toyamakoichi/status/1413379580073693184,False,https://twitter.com/toyamakoichi/status/1413379228339298305,0,,,,,,,,[],,,,
1413379323067658243,1413379323067658243,2021-07-09 06:07:44 UTC,2021-07-09,06:07:44,+0000,171793885,toyamakoichi,外山恒一,,その場でも繰り返し云ったが、せめて会って（昨年のズームでの喧嘩についてではなく本来の論点であるはずの“あいトリ”のことを）話せばいいのに。しかも私的に会えばいいのであってそれを公開する必要もない（公開でやるとどうしてもポジション・トークが混じったり“勝敗”にこだわったりする）。,ja,[],[],[],0,29,78,[],[],https://twitter.com/toyamakoichi/status/1413379323067658243,False,https://twitter.com/toyamakoichi/status/1413379228339298305,0,,,,,,,,[],,,,
1413379228339298305,1413379228339298305,2021-07-09 06:07:22 UTC,2021-07-09,06:07:22,+0000,171793885,toyamakoichi,外山恒一,,昨年の私と東浩紀氏の対談（ https://t.co/2HA2eNRnbn ）……というよりその第２部（ https://t.co/1UtkErQQGt ）での東氏と津田大介氏の喧嘩？が再燃してるようだ。酔ってカラんだに近い東氏がそもそも悪いんだが、今さら手続き論みたいな側面を云々する津田氏も（悪い意味で）いかにもリベラルっぽい。,ja,[],"['https://bit.ly/3qXtwIG', 'https://bit.ly/3yyz7b4']",[],1,57,135,[],[],https://twitter.com/toyamakoichi/status/1413379228339298305,False,,0,,,,,,,,[],,,,
1413364964023169027,1413364964023169027,2021-07-09 05:10:41 UTC,2021-07-09,05:10:41,+0000,171793885,toyamakoichi,外山恒一,,肝心の外国選手団の参加辞退が相次げば……と。 @munesama0712 それでもやると思う ミュンヘンオリンピックの最中にイスラエル選手団が襲撃されて死者が出ても続行された @toyamakoichi オリンピック中止にしたければマスクもせずガンガン出歩いて感染爆発させればいい,ja,"[{'screen_name': 'munesama0712', 'name': '金子宗徳＠月刊『国体文化』編集長', 'id': '113751176'}, {'screen_name': 'toyamakoichi', 'name': '外山恒一', 'id': '171793885'}]",[],[],1,12,47,[],[],https://twitter.com/toyamakoichi/status/1413364964023169027,False,,0,,,,,,,,[],,,,
1413359923606343683,1413359923606343683,2021-07-09 04:50:39 UTC,2021-07-09,04:50:39,+0000,171793885,toyamakoichi,外山恒一,,だ・か・ら！　そんなにオリンピック中止にしたければ反対派全員、マスクもせずガンガン出歩いて感染爆発させればいいのだ。まだ間に合う（笑）。,ja,[],[],[],7,143,355,[],[],https://twitter.com/toyamakoichi/status/1413359923606343683,False,,0,,,,,,,,[],,,,
1413174117281374209,1413174117281374209,2021-07-08 16:32:19 UTC,2021-07-08,16:32:19,+0000,171793885,toyamakoichi,外山恒一,,あれは、ワクチン開発前でないと意味のない戦法です。とはいえ、単に気にせず出歩けばいいのは今も同じですが。,ja,[],[],[],0,23,68,[],[],https://twitter.com/toyamakoichi/status/1413174117281374209,False,https://twitter.com/extomato/status/1413082618048901123,0,,,,,,,,[],,,,
1411622101669216261,1411622101669216261,2021-07-04 09:45:10 UTC,2021-07-04,09:45:10,+0000,171793885,toyamakoichi,外山恒一,,以前、似たような飲酒謀議レポートをツイートしたら、ヘサヨ系と思しき方面から“床屋政談”呼ばわりの非難がましいリプライが来た。飲み屋で“床屋”政談して何が悪いんだ、この野暮ちんが！,ja,[],[],[],0,5,43,[],[],https://twitter.com/toyamakoichi/status/1411622101669216261,False,https://twitter.com/toyamakoichi/status/1411622056479760388,0,,,,,,,,[],,,,
1411622056479760388,1411622056479760388,2021-07-04 09:44:59 UTC,2021-07-04,09:44:59,+0000,171793885,toyamakoichi,外山恒一,,最終的亡国を担ってくれる進次郎政権の成立までのつなぎとして安倍ちゃんに再登板願うのもいいが、どうせなら昭恵さんを“日本のヒラリー”としてヨイショし、擁立しては？　反原発派で大麻解放論者だから一部左派も、安倍ちゃんのお墨付きならバカウヨも、合流するかもしれんと鹿児島飲酒謀議にて提起。,ja,[],[],[],0,62,203,[],[],https://twitter.com/toyamakoichi/status/1411622056479760388,False,,0,,,,,,,,[],,,,
1411621489435025411,1411621489435025411,2021-07-04 09:42:44 UTC,2021-07-04,09:42:44,+0000,171793885,toyamakoichi,外山恒一,,ちょっくら鹿児島まで遠征し、「劇団どくんご」の山岳ベースを御機嫌伺いに訪れ、国分市で隼人族の友人たちと飲み、実家に立ち寄って母に料理を習い、市内の行きつけの飲み屋数軒をハシゴして、いましがた福岡に帰還。,ja,[],[],[],1,9,45,[],[],https://twitter.com/toyamakoichi/status/1411621489435025411,False,,0,,,,,,,,[],,,,
1409834176908460036,1409805355660365824,2021-06-29 11:20:35 UTC,2021-06-29,11:20:35,+0000,171793885,toyamakoichi,外山恒一,,@scratch_days 私の英語力では判断つかないのだが、最後のitは要るのかなあ？,ja,[],[],[],1,0,3,[],[],https://twitter.com/toyamakoichi/status/1409834176908460036,False,,0,,,,,,,,"[{'screen_name': 'scratch_days', 'name': 'カツヤ', 'id': '2370098918'}]",,,,
1409825476428767238,1409825476428767238,2021-06-29 10:46:01 UTC,2021-06-29,10:46:01,+0000,171793885,toyamakoichi,外山恒一,,学校英語の例文では温暖化は云々しても原発にはほとんど触れない。うーん怪しい…。まあ温暖化してるのかもしれんが、まず原発を全部止めない限り私はそんな話には耳を貸さない決意である。反原発派の諸君は心を鬼にして、ゴミ削減やリサイクル推進の努力を一斉に放棄して政府を困らせればよかろう。,ja,[],[],[],0,23,72,[],[],https://twitter.com/toyamakoichi/status/1409825476428767238,False,,0,,,,,,,,[],,,,
1409795432906059780,1409795432906059780,2021-06-29 08:46:38 UTC,2021-06-29,08:46:38,+0000,171793885,toyamakoichi,外山恒一,,「学校英語の例文ときたら、やれ温暖化だの女性の社会進出だの喫煙の害だの、学歴社会で栄達しそうな者を受験勉強にかこつけて洗脳し、まんまとポリコレ推進の尖兵に仕立てあげようという、極左勢力の陰謀に違いない。」という日本文を英訳しなさい。,ja,[],[],[],2,143,412,[],[],https://twitter.com/toyamakoichi/status/1409795432906059780,False,,0,,,,,,,,[],,,,
1409795195067985920,1409795195067985920,2021-06-29 08:45:41 UTC,2021-06-29,08:45:41,+0000,171793885,toyamakoichi,外山恒一,,レーニンがプチブル・インテリを下層大衆への負い目から解放した点は素晴らしい。しかしマルクス主義者だったので、プチブル・インテリが獲得した“真理”に大衆の同意を取りつけようとした。そこがいかん。大衆には余計なお世話で、大迷惑でしかない。,ja,[],[],[],0,22,70,[],[],https://twitter.com/toyamakoichi/status/1409795195067985920,False,,0,,,,,,,,[],,,,
1408394017352470536,1408394017352470536,2021-06-25 11:57:55 UTC,2021-06-25,11:57:55,+0000,171793885,toyamakoichi,外山恒一,,参加募集をかけたら志願者が殺到したので、いっそ前半・後半の２回やることにした次回８月の「教養強化合宿」、それでもすでに定員オーバー気味で、こりゃ本当に“不合格者”を出さなきゃいけなくなりそう。まさに難関私塾だ。今から志願するなら倍率の低い後半日程がオススメ！  https://t.co/Oltzbebu0R,ja,[],['https://bit.ly/3p4RgcU'],[],0,38,84,[],[],https://twitter.com/toyamakoichi/status/1408394017352470536,False,,0,,,,,,,,[],,,,
1406821060813545479,1406821060813545479,2021-06-21 03:47:33 UTC,2021-06-21,03:47:33,+0000,171793885,toyamakoichi,外山恒一,,８月の第15回「教養強化合宿」への参加希望学生が案の定あっというまに定員オーバー気味となり、えーい、いっそのこと前半に第15回合宿、後半に第15.5回合宿を開催することにした。  https://t.co/Oltzbebu0R,ja,[],['https://bit.ly/3p4RgcU'],[],0,21,66,[],[],https://twitter.com/toyamakoichi/status/1406821060813545479,False,,0,,,,,,,,[],,,,
1406820368883470336,1406820368883470336,2021-06-21 03:44:48 UTC,2021-06-21,03:44:48,+0000,171793885,toyamakoichi,外山恒一,,全部おすすめ（笑）noteコンテンツ一覧  https://t.co/9XWDcHGTX7 『全共闘以後』 https://t.co/724wPjdL5y 『政治活動入門』 https://t.co/c0D44vABTw ６月下旬〜７月末 外山文献英訳作業員募集  https://t.co/g1pUEoESDc ８月 第15回および第15.5回教養強化合宿参加者募集  https://t.co/Oltzbebu0R,ja,[],"['http://bit.ly/2R0VBz8', 'http://amzn.to/2OVoW9j', 'http://amzn.to/3t9kQ2A', 'https://bit.ly/34ycLJM', 'https://bit.ly/3p4RgcU']",[],0,2,20,[],[],https://twitter.com/toyamakoichi/status/1406820368883470336,False,,0,,,,,,,,[],,,,
1406819863088177155,1406819863088177155,2021-06-21 03:42:47 UTC,2021-06-21,03:42:47,+0000,171793885,toyamakoichi,外山恒一,,【業務連絡】現時点ですでに第15回「教養強化合宿」に参加希望メールを出した学生諸君は、迷惑メール・ボックスなど含めて私からのメールをチェックしてください。,ja,[],[],[],0,2,7,[],[],https://twitter.com/toyamakoichi/status/1406819863088177155,False,,0,,,,,,,,[],,,,
1406796315594399747,1406796315594399747,2021-06-21 02:09:13 UTC,2021-06-21,02:09:13,+0000,171793885,toyamakoichi,外山恒一,,【私的連絡】首都圏の合宿出身者の、出世頭Ｓさん、早稲田アナ研のＨ君、三軽皇子Ｍ君、右派の代表格Ｓ君、炎の14期の火元Ｓ君、迷惑メール・ボックスをチェックしてください。【最近私からのメールは迷惑メールに分類されてしまうようなのである】,ja,[],[],[],0,4,32,[],[],https://twitter.com/toyamakoichi/status/1406796315594399747,False,,0,,,,,,,,[],,,,
1405873611550851074,1405873611550851074,2021-06-18 13:02:43 UTC,2021-06-18,13:02:43,+0000,171793885,toyamakoichi,外山恒一,,明日（6/19）の“熊本出張版・外山恒一展”、10:00～18:00で観覧可能とのこと。それにしても今日、約12時間かけて独力で先日の小倉での“正規版”展示に近いぐらいの大量のブツを展示しきった。たった１日のみというのがもったいないほどだ。,ja,[],[],[],0,7,25,[],[],https://twitter.com/toyamakoichi/status/1405873611550851074,False,https://twitter.com/toyamakoichi/status/1405512910462275592,0,,,,,,,,[],,,,
1405569235745525762,1405569235745525762,2021-06-17 16:53:14 UTC,2021-06-17,16:53:14,+0000,171793885,toyamakoichi,外山恒一,,行ったり来たりでもはやどっちが本拠だか分かんなくなってくるが、“１日外山展”のための展示品を福岡まで戻って満載して、熊本に帰還。,ja,[],[],[],0,1,19,[],[],https://twitter.com/toyamakoichi/status/1405569235745525762,False,,0,,,,,,,,[],,,,
