id,conversation_id,created_at,date,time,timezone,user_id,username,name,place,tweet,language,mentions,urls,photos,replies_count,retweets_count,likes_count,hashtags,cashtags,link,retweet,quote_url,video,thumbnail,near,geo,source,user_rt_id,user_rt,retweet_id,reply_to,retweet_date,translate,trans_src,trans_dest
1413827909429587973,1413827909429587973,2021-07-10 11:50:15 UTC,2021-07-10,11:50:15,+0000,127773410,tutiyak,土屋幸太郎@土屋薬局 山形県東根市,,豆腐を水抜きしてから、いんげんと豆腐を炒め、大根おろしをかけ、紫蘇をかけて麺つゆで味付けです。  いんげん→消化吸収をよくし浮腫み解消  豆腐→疲労回復、ストレス緩和に  大根→消化を良くしてお腹スッキリ  紫蘇→梅雨のジメジメを爽やかに  梅雨空を食事で乗り越えましょう〜青空はもうすぐ！  https://t.co/mx8AY2qe1z,ja,[],[],['https://pbs.twimg.com/media/E57s_JVVEAIN0ej.jpg'],1,45,359,[],[],https://twitter.com/tutiyak/status/1413827909429587973,False,,1,https://pbs.twimg.com/media/E57s_JVVEAIN0ej.jpg,,,,,,,[],,,,
1413789939402108928,1413789939402108928,2021-07-10 09:19:23 UTC,2021-07-10,09:19:23,+0000,127773410,tutiyak,土屋幸太郎@土屋薬局 山形県東根市,,今日は土曜日で妻も息子と一緒にときおりお店にでてきたのですが、処方せんのお客様やまた漢方のお客様たちにもお会いしたりして、皆さま「めんこいねー」と言っていただいて喜んでもらいました。家でグズっていてもお店だと寝てるから、機嫌が良いから不思議です。ではではお疲れ様でしたー。よい晩を  https://t.co/77n11DQYUF,ja,[],[],"['https://pbs.twimg.com/media/E57Kc-gUcAMe5kF.jpg', 'https://pbs.twimg.com/media/E57Kc-hVcAMh3NC.jpg', 'https://pbs.twimg.com/media/E57Kc-jUUAMEtvT.jpg']",1,12,346,[],[],https://twitter.com/tutiyak/status/1413789939402108928,False,,1,https://pbs.twimg.com/media/E57Kc-gUcAMe5kF.jpg,,,,,,,[],,,,
1413754008733306883,1413754008733306883,2021-07-10 06:56:36 UTC,2021-07-10,06:56:36,+0000,127773410,tutiyak,土屋幸太郎@土屋薬局 山形県東根市,,夏で暑くなると冷えたドリンクや氷水、ビールに手が伸びますが、消化力が低下して体の元気が無くなってしまいます。  胃腸機能の低下は食欲不振や下痢、吐き気、胃もたれ、むくみなどの症状に。  そんな時にお助け漢方薬が体内の余分な湿気を除く勝湿顆粒や消化を助ける晶三仙です。  ご相談下さい！  https://t.co/sDjEReN09L,ja,[],[],"['https://pbs.twimg.com/media/E56pxxgVcAABwMn.jpg', 'https://pbs.twimg.com/media/E56pxxhUUAIhQIf.jpg']",0,23,176,[],[],https://twitter.com/tutiyak/status/1413754008733306883,False,,1,https://pbs.twimg.com/media/E56pxxgVcAABwMn.jpg,,,,,,,[],,,,
1413720637135228931,1413657705680576512,2021-07-10 04:44:00 UTC,2021-07-10,04:44:00,+0000,127773410,tutiyak,土屋幸太郎@土屋薬局 山形県東根市,,@kaichian0402 はい、生後2ヶ月で日々の成長ぶりに目を見張っています。息子は師匠です！,ja,[],[],[],1,0,1,[],[],https://twitter.com/tutiyak/status/1413720637135228931,False,,0,,,,,,,,"[{'screen_name': 'kaichian0402', 'name': 'リラックマ', 'id': '966352022713778176'}]",,,,
1413720419710820352,1413657705680576512,2021-07-10 04:43:08 UTC,2021-07-10,04:43:08,+0000,127773410,tutiyak,土屋幸太郎@土屋薬局 山形県東根市,,@uimny12379 毎日が合宿生活をしているような、修学旅行に来ているようなそんな感じです。楽しんでいきます。,ja,[],[],[],0,0,1,[],[],https://twitter.com/tutiyak/status/1413720419710820352,False,,0,,,,,,,,"[{'screen_name': 'uimny12379', 'name': 'eri', 'id': '773878726333431808'}]",,,,
1413718279193960455,1413657705680576512,2021-07-10 04:34:38 UTC,2021-07-10,04:34:38,+0000,127773410,tutiyak,土屋幸太郎@土屋薬局 山形県東根市,,@mayumik_630 こんにちは！ありがとうございます。子育て、今しかできない貴重な体験で、しかも50代の父親ですから楽しんでいます。😊,ja,[],[],[],0,0,1,[],[],https://twitter.com/tutiyak/status/1413718279193960455,False,,0,,,,,,,,"[{'screen_name': 'mayumik_630', 'name': 'まゆみ', 'id': '1038585196252033024'}]",,,,
1413717287861833735,1413717287861833735,2021-07-10 04:30:41 UTC,2021-07-10,04:30:41,+0000,127773410,tutiyak,土屋幸太郎@土屋薬局 山形県東根市,,梅雨時のだるさ、めまい、軟便、月経不順、月経痛などの原因は湿邪かも。  【胡瓜と茗荷の漬物】  キュウリは、過剰な水分をのぞきながら、必要な体液を補います。高温多湿の疲れやだるさに理想的な食材です。  ミョウガの辛味、香り成分もむくみを解消し血行を改善に役立ちます。夏野菜で梅雨を元気に  https://t.co/RFbtzNFkZ3,ja,[],[],['https://pbs.twimg.com/media/E56IYH_VgAIUzEH.jpg'],2,55,363,[],[],https://twitter.com/tutiyak/status/1413717287861833735,False,,1,https://pbs.twimg.com/media/E56IYH_VgAIUzEH.jpg,,,,,,,[],,,,
1413696662082445312,1413696662082445312,2021-07-10 03:08:44 UTC,2021-07-10,03:08:44,+0000,127773410,tutiyak,土屋幸太郎@土屋薬局 山形県東根市,,寒河江市から当店で子宝漢方をご利用していたお客様が生後45日くらいの赤ちゃんを抱いて家族3人でご来店。私もすぐに妻と息子を呼んで、赤ちゃんたちのご対面でした。向こうの赤ちゃんは髪の毛フサフサでめんこかったです。息子も大きくなってます。将来お友達になってねー。ではよい午後をー！  https://t.co/qSFRmX3on6,ja,[],[],['https://pbs.twimg.com/media/E551nnyUUAM1Di4.jpg'],0,8,334,[],[],https://twitter.com/tutiyak/status/1413696662082445312,False,,1,https://pbs.twimg.com/media/E551nnyUUAM1Di4.jpg,,,,,,,[],,,,
1413657705680576512,1413657705680576512,2021-07-10 00:33:56 UTC,2021-07-10,00:33:56,+0000,127773410,tutiyak,土屋幸太郎@土屋薬局 山形県東根市,,おはようございます。  生後2ヶ月を過ぎた息子。最近は左手の使い方覚えてきてタオルを下から上に上げて自分の顔にかける遊びを覚えたようです。手を握る、叩くなどしっかりしてきました。朝からミルク、うんち、ゲップ出しで大忙しでちょっとしたお祭りです。どっこい、どっこい。ではよい一日で！  https://t.co/rN3YG30QAc,ja,[],[],"['https://pbs.twimg.com/media/E55SL1kVEAI1PrQ.jpg', 'https://pbs.twimg.com/media/E55SL1lVEAABwgt.jpg', 'https://pbs.twimg.com/media/E55SL1kVoAMYDUX.jpg']",15,18,567,[],[],https://twitter.com/tutiyak/status/1413657705680576512,False,,1,https://pbs.twimg.com/media/E55SL1kVEAI1PrQ.jpg,,,,,,,[],,,,
1413616432806383616,1413616432806383616,2021-07-09 21:49:55 UTC,2021-07-09,21:49:55,+0000,127773410,tutiyak,土屋幸太郎@土屋薬局 山形県東根市,,鹿児島、宮崎、熊本に大雨特別警報発生など日本各地心配です。  【不安を感じたら労宮のツボ】  こぶしを作った時に中指と薬指の先駆け当たるあたりです。  不安を感じたら押しましょう。  手のひらを横に開いたり外側に反らしたりセルフケアでストレッチもさらに効果的。  週末はお気をつけください。  https://t.co/aWzgq2jj2e,ja,[],[],"['https://pbs.twimg.com/media/E54spzgVEAUBW1B.jpg', 'https://pbs.twimg.com/media/E54spzhVIAAjnw7.jpg', 'https://pbs.twimg.com/media/E54spzhUUAAYtrF.jpg']",1,126,457,[],[],https://twitter.com/tutiyak/status/1413616432806383616,False,,1,https://pbs.twimg.com/media/E54spzgVEAUBW1B.jpg,,,,,,,[],,,,
1413464814211371008,1413464814211371008,2021-07-09 11:47:27 UTC,2021-07-09,11:47:27,+0000,127773410,tutiyak,土屋幸太郎@土屋薬局 山形県東根市,,1)疲れやすい 4点  2)風邪をひきやすい 5点  3)よく息切れがする 5点  4)冷え性 4点  5)胃もたれがしやすい 4点  6)軟便、下痢をしやすい 4点  7)頻尿、夜間尿 4点  8)舌は色が淡くて大きく腫れて縁に歯の形がみえる。5点  子宮内膜症、チョコレート嚢胞の漢方の原因の秘密￼  https://t.co/4dAS1o3Ucj,ja,[],['https://www.tutiya-kanpo.co.jp/entry/2016/06/20/000756'],[],0,12,118,[],[],https://twitter.com/tutiyak/status/1413464814211371008,False,,0,,,,,,,,[],,,,
1413420937991524354,1413420937991524354,2021-07-09 08:53:06 UTC,2021-07-09,08:53:06,+0000,127773410,tutiyak,土屋幸太郎@土屋薬局 山形県東根市,,梅雨前線で低気圧で雨降りモヤモヤ。頭痛やめまい、だるさなど体調不良に気をつけてくださいね。  夕飯では、ねぎ、生姜、紫蘇などの辛味成分は頭痛と風邪予防に役立ちます。  週末のストレスには、セロリ、きゅうり、トマト、ミントティー、緑茶などは頭にこもった熱を下げます。早寝もお勧めです。  https://t.co/eXfT9piJ2o,ja,[],[],"['https://pbs.twimg.com/media/E5162YbVUAQaQMp.jpg', 'https://pbs.twimg.com/media/E5162YbUcAE92zU.jpg', 'https://pbs.twimg.com/media/E5162YaVEAM1Eke.jpg', 'https://pbs.twimg.com/media/E5162YbVcAYm81r.jpg']",2,100,588,[],[],https://twitter.com/tutiyak/status/1413420937991524354,False,,1,https://pbs.twimg.com/media/E5162YbVUAQaQMp.jpg,,,,,,,[],,,,
1413359938064109569,1413359938064109569,2021-07-09 04:50:42 UTC,2021-07-09,04:50:42,+0000,127773410,tutiyak,土屋幸太郎@土屋薬局 山形県東根市,,梅雨の長雨です。  日照時間も少なく、憂うつ、だるく疲れやすくなります。  この季節が苦手な方は、余分な水分が溜まっています。冷たい飲食物を控え、足首や膝の冷えに注意しましょう。  毎日のお茶は緑茶やハトムギ茶のようなあっさり系がお勧め。  特に緑茶に紫蘇を加えると湿気払いになりますよー  https://t.co/OQZcpq0BZv,ja,[],[],"['https://pbs.twimg.com/media/E51DXtfUcAMi4KZ.jpg', 'https://pbs.twimg.com/media/E51DXtfVgAAQ-GA.jpg']",2,96,472,[],[],https://twitter.com/tutiyak/status/1413359938064109569,False,,1,https://pbs.twimg.com/media/E51DXtfUcAMi4KZ.jpg,,,,,,,[],,,,
1413330163450793984,1413330163450793984,2021-07-09 02:52:24 UTC,2021-07-09,02:52:24,+0000,127773410,tutiyak,土屋幸太郎@土屋薬局 山形県東根市,,漢方コラム第一話「梅雨入りとフィリピン」  湿度が高い季節は水虫や湿疹、下痢吐き気、だるさ、神経痛などのトラブルが起こりやすく湿邪によることが多いです。呉の海上保安庁OBから海国日本！と聞いたことも懐かしいのですが、中医学の湿邪（しつじゃ）のコラムぜひどうぞ↓  https://t.co/qQHWKpaV68,ja,[],['https://tutiya-yakkyoku.jp/colm1.htm'],[],1,5,91,[],[],https://twitter.com/tutiyak/status/1413330163450793984,False,,0,,,,,,,,[],,,,
1413316181285498880,1413316181285498880,2021-07-09 01:56:50 UTC,2021-07-09,01:56:50,+0000,127773410,tutiyak,土屋幸太郎@土屋薬局 山形県東根市,,こんにちは！  幸せな人は、そうでない人と比べると7.5から10年間長生きという研究結果があるそうです。  「幸せな人は良い生活習慣を持つ」  「幸せそのものが体に良い影響がある」  ということだそうです。  一日の終わりは、良かったこと3つを書き出して毎日をお過ごし下さい。金曜よい一日で！  https://t.co/ObyGF23CRP,ja,[],[],['https://pbs.twimg.com/media/E50bkYlUcAEGlVf.jpg'],4,31,376,[],[],https://twitter.com/tutiyak/status/1413316181285498880,False,,1,https://pbs.twimg.com/media/E50bkYlUcAEGlVf.jpg,,,,,,,[],,,,
1413295182041149440,1413295182041149440,2021-07-09 00:33:23 UTC,2021-07-09,00:33:23,+0000,127773410,tutiyak,土屋幸太郎@土屋薬局 山形県東根市,,おはようございます。 今日は1時に私がミルク、5時に妻がミルク。私の担当の時には180ミリのんで驚きでした。  くじら柄の🐳🐋のメッシュで夏の蒸し暑さ対策に。タオルはスティッチ。スティッチは香港ディズニーランドで広東語で喋っていて妻と完全アウェイだったことなど懐かしいです。よい一日で！  https://t.co/t5gvjdZH3g,ja,[],[],['https://pbs.twimg.com/media/E50IeA5VoAEVI2k.jpg'],11,11,537,[],[],https://twitter.com/tutiyak/status/1413295182041149440,False,,1,https://pbs.twimg.com/media/E50IeA5VoAEVI2k.jpg,,,,,,,[],,,,
1413251189513232388,1413251189513232388,2021-07-08 21:38:35 UTC,2021-07-08,21:38:35,+0000,127773410,tutiyak,土屋幸太郎@土屋薬局 山形県東根市,,こころのびのび  心のバランスが崩れていると感じたら、体をよく伸ばすことが大切  体をぐんと伸ばすことで、硬くなった心がのびのびしていくのをイメージして  大の字にうつぶせになり、手足を伸ばします。  足と手それぞれで、先にあるものを指でとろうとするように伸ばします。  心をのびのびー  https://t.co/MQUeqwF4GC,ja,[],[],['https://pbs.twimg.com/media/E5zgd1YVEAEvMEs.jpg'],2,74,412,[],[],https://twitter.com/tutiyak/status/1413251189513232388,False,,1,https://pbs.twimg.com/media/E5zgd1YVEAEvMEs.jpg,,,,,,,[],,,,
1413085658311053313,1413085658311053313,2021-07-08 10:40:49 UTC,2021-07-08,10:40:49,+0000,127773410,tutiyak,土屋幸太郎@土屋薬局 山形県東根市,,今の時代は頭脳労働です。  昔の時代は体を使ってぐっすり眠れた。  頭を使う、首から上がのぼせる  【思則気結】  思いすぎると気が結ぶ ↓ 更年期のようなのぼせ、足の冷え、胃腸の不調、ガス、吐き気、イライラ、不眠などの不調が現れる。  のぼせるからといってお腹を冷やすと身体を傷つける！,ja,[],[],[],0,47,321,[],[],https://twitter.com/tutiyak/status/1413085658311053313,False,,0,,,,,,,,[],,,,
1413073843250286602,1413073843250286602,2021-07-08 09:53:52 UTC,2021-07-08,09:53:52,+0000,127773410,tutiyak,土屋幸太郎@土屋薬局 山形県東根市,,【辛い味がお好きなあなたへ】  なぜ辛い味が好きというと、ストレスが続くと気が詰まってしまうから、辛い味で発散したいからです。  辛い味でお勧めなものは、胃腸にも優しい薄荷のミントティーです。  気分リフレッシュハーブ！  またストレスで気が詰まってたら泣いた方がいい。  スッとします。  https://t.co/XX293VvPhL,ja,[],[],['https://pbs.twimg.com/media/E5w_K5ZVoAA7DSz.jpg'],2,72,413,[],[],https://twitter.com/tutiyak/status/1413073843250286602,False,,1,https://pbs.twimg.com/media/E5w_K5ZVoAA7DSz.jpg,,,,,,,[],,,,
1413062419270623234,1413062419270623234,2021-07-08 09:08:28 UTC,2021-07-08,09:08:28,+0000,127773410,tutiyak,土屋幸太郎@土屋薬局 山形県東根市,,【４４歳のお客様　ＦＳＨ３９でしたが漢方服用後、妊娠、出産！の話です】  不妊症の子宝相談で漢方相談したお客様、44歳だったけど自然妊娠さして、喜ばれていて今日も経過報告の電話かかってきました。補腎で命門の火を強くしよう！  続きは↓  https://t.co/ThGbWarh7q,ja,[],['https://www.tutiya-kanpo.co.jp/entry/2011/11/22/095042'],[],0,3,77,[],[],https://twitter.com/tutiyak/status/1413062419270623234,False,,0,,,,,,,,[],,,,
