id,conversation_id,created_at,date,time,timezone,user_id,username,name,place,tweet,language,mentions,urls,photos,replies_count,retweets_count,likes_count,hashtags,cashtags,link,retweet,quote_url,video,thumbnail,near,geo,source,user_rt_id,user_rt,retweet_id,reply_to,retweet_date,translate,trans_src,trans_dest
1413996454356480001,1413996454356480001,2021-07-10 23:00:00 UTC,2021-07-10,23:00:00,+0000,126230151,yukiofunaibot,舩井幸雄bot,,自分から行動を起こさない限り、幸せはつかめません。 舩井幸雄,ja,[],[],[],0,1,23,[],[],https://twitter.com/yukiofunaibot/status/1413996454356480001,False,,0,,,,,,,,[],,,,
1413634070324514817,1413634070324514817,2021-07-09 23:00:01 UTC,2021-07-09,23:00:01,+0000,126230151,yukiofunaibot,舩井幸雄bot,,成長を続けていきますと、やる前から諦めてしまうといった、否定的な発想も消えていきます。小さな成功を手にしてきた自信と経験が、その発想を彼方に追いやるからです。一方で、自分は何ができるかといった、正確な自己評価もできてきます。 舩井幸雄,ja,[],[],[],0,1,18,[],[],https://twitter.com/yukiofunaibot/status/1413634070324514817,False,,0,,,,,,,,[],,,,
1413271680122642435,1413271680122642435,2021-07-08 23:00:00 UTC,2021-07-08,23:00:00,+0000,126230151,yukiofunaibot,舩井幸雄bot,,あなたがほんとうの道を選び、責任とリスクをもって成長を続けているのなら、願望を確かにもって努力しているのなら、マイナス感情は日々薄れていくでしょう。 舩井幸雄,ja,[],[],[],0,2,20,[],[],https://twitter.com/yukiofunaibot/status/1413271680122642435,False,,0,,,,,,,,[],,,,
1412909292106047496,1412909292106047496,2021-07-07 23:00:00 UTC,2021-07-07,23:00:00,+0000,126230151,yukiofunaibot,舩井幸雄bot,,自分はどうしても受け身思考になってしまう、弱者思考をしてしまうという人は、自分をプラスにできる世界を見つけて、そこで頑張るのが賢いやり方でしょう。そうして自分の長所や好きな分野といった特性の世界に生きることによって、正しい自分観をつくるのだと思います。 舩井幸雄,ja,[],[],[],0,1,22,[],[],https://twitter.com/yukiofunaibot/status/1412909292106047496,False,,0,,,,,,,,[],,,,
1412546905620418565,1412546905620418565,2021-07-06 23:00:00 UTC,2021-07-06,23:00:00,+0000,126230151,yukiofunaibot,舩井幸雄bot,,成長することは、ほんとうに楽しいことです。何と言ってもこれまでできなかったことができるようになるのですから。 舩井幸雄,ja,[],[],[],0,1,23,[],[],https://twitter.com/yukiofunaibot/status/1412546905620418565,False,,0,,,,,,,,[],,,,
1412184515292794880,1412184515292794880,2021-07-05 23:00:00 UTC,2021-07-05,23:00:00,+0000,126230151,yukiofunaibot,舩井幸雄bot,,問題を「問題」にしなくて済むようになりますと、問題から逃げない、つまり問題を認める肯定的な姿勢となります。また、自分の範疇で問題は解決できるようになっていますので、その分、心は自由になります。だから、成長するにつれて、人間は自由の心を持つようになるのです。  舩井幸雄,ja,[],[],[],0,0,28,[],[],https://twitter.com/yukiofunaibot/status/1412184515292794880,False,,0,,,,,,,,[],,,,
1411822128609992707,1411822128609992707,2021-07-04 23:00:00 UTC,2021-07-04,23:00:00,+0000,126230151,yukiofunaibot,舩井幸雄bot,,私が言う素直とは、「知らないことを否定しないこと」「間違ったことを改めること」「正しいとわかったら正しいことをすること」といった意味でとらえて下さい。というのも、勉強する時に一番必要なのは「素直」であることだからです。 舩井幸雄,ja,[],[],[],0,5,35,[],[],https://twitter.com/yukiofunaibot/status/1411822128609992707,False,,0,,,,,,,,[],,,,
1411459741679689729,1411459741679689729,2021-07-03 23:00:00 UTC,2021-07-03,23:00:00,+0000,126230151,yukiofunaibot,舩井幸雄bot,,願望達成の秘訣は、必ず実現するんだという念を強く思い続けることです。その念を思い続けるためにも、単なる目標ではなく、希望つきの目標がいいのです。単なる目標だと、どうしても、途中で挫折してしまいやすいのが人間だからです。 舩井幸雄,ja,[],[],[],0,3,22,[],[],https://twitter.com/yukiofunaibot/status/1411459741679689729,False,,0,,,,,,,,[],,,,
1411097354090934277,1411097354090934277,2021-07-02 23:00:00 UTC,2021-07-02,23:00:00,+0000,126230151,yukiofunaibot,舩井幸雄bot,,結局、“つく人”、“運のよい人”の条件は、他人からストレートに自分に対する意見をいわれても、喜んで聞ける人であるように思います。 舩井幸雄,ja,[],[],[],0,3,30,[],[],https://twitter.com/yukiofunaibot/status/1411097354090934277,False,,0,,,,,,,,[],,,,
1410734968255377413,1410734968255377413,2021-07-01 23:00:01 UTC,2021-07-01,23:00:01,+0000,126230151,yukiofunaibot,舩井幸雄bot,,人を信じることは人に信じられることにもつながる。そして、それが勝者への道、人格者への道、つきと好運への道であることは人生の真実といってよいでしょう。 舩井幸雄,ja,[],[],[],0,2,21,[],[],https://twitter.com/yukiofunaibot/status/1410734968255377413,False,,0,,,,,,,,[],,,,
1410372577961287683,1410372577961287683,2021-06-30 23:00:00 UTC,2021-06-30,23:00:00,+0000,126230151,yukiofunaibot,舩井幸雄bot,,人はさまざまですが、成功する人は、思いやりがあり、実行に移せる人が多いです。別のことばでいえば、つく人、運のよい人は、思いやりを実行に移せる人といってもよいようです。 舩井幸雄,ja,[],[],[],0,2,36,[],[],https://twitter.com/yukiofunaibot/status/1410372577961287683,False,,0,,,,,,,,[],,,,
1410010191253282818,1410010191253282818,2021-06-29 23:00:00 UTC,2021-06-29,23:00:00,+0000,126230151,yukiofunaibot,舩井幸雄bot,,運は自分で連れてくるものであり、つくかどうかも自分の責任です。運とかツキが来るためのポイント、それは応援し、助けてくれるよい友人が増えることといえるでしょう。 舩井幸雄,ja,[],[],[],0,4,31,[],[],https://twitter.com/yukiofunaibot/status/1410010191253282818,False,,0,,,,,,,,[],,,,
1409647804956348430,1409647804956348430,2021-06-28 23:00:01 UTC,2021-06-28,23:00:01,+0000,126230151,yukiofunaibot,舩井幸雄bot,,人格者の特性は、人を大事にすること。たえず人が集まってくることです。人を大事にするためには、苦労して、人の大事さ、人が去っていく悲しさを知らねばなりません。 舩井幸雄,ja,[],[],[],0,5,29,[],[],https://twitter.com/yukiofunaibot/status/1409647804956348430,False,,0,,,,,,,,[],,,,
1409285417552080898,1409285417552080898,2021-06-27 23:00:01 UTC,2021-06-27,23:00:01,+0000,126230151,yukiofunaibot,舩井幸雄bot,,人格者というのは、だれもが納得できる分かりやすい理念、哲学を持ち、愛の気持ちをあふれさせて生きている人で、たとえばその人の部下であることに誇りを感じ、安心できる人である。思いやりに満ちた人ともいえます。 舩井幸雄,ja,[],[],[],0,1,25,[],[],https://twitter.com/yukiofunaibot/status/1409285417552080898,False,,0,,,,,,,,[],,,,
1408923027522285572,1408923027522285572,2021-06-26 23:00:00 UTC,2021-06-26,23:00:00,+0000,126230151,yukiofunaibot,舩井幸雄bot,,仕事を好きになってください。仕事が好きになってしまえば、四六時中、仕事のことを考えていても、苦にはなりません。楽しいことをしながら、自分の能力を発揮し、いい結果を出していくと、ますます仕事が好きになるという好循環が生まれます。 舩井幸雄,ja,[],[],[],0,4,29,[],[],https://twitter.com/yukiofunaibot/status/1408923027522285572,False,,0,,,,,,,,[],,,,
1408560640801722372,1408560640801722372,2021-06-25 23:00:01 UTC,2021-06-25,23:00:01,+0000,126230151,yukiofunaibot,舩井幸雄bot,,世の中には、自分がどうして生まれてきたか、何をしなければいけないのか、何をするために生きているのかわからない……と、とまどっている人が少なくありません。ですが、ひとこと断っておきます。この世に存在価値のない人などは、一人もいないということを。 舩井幸雄,ja,[],[],[],0,3,35,[],[],https://twitter.com/yukiofunaibot/status/1408560640801722372,False,,0,,,,,,,,[],,,,
1408198251799400452,1408198251799400452,2021-06-24 23:00:00 UTC,2021-06-24,23:00:00,+0000,126230151,yukiofunaibot,舩井幸雄bot,,「長所を伸ばすのはいいけれど、同時に短所も直すべきではないのか。短所を放っておけば、根本的には成長できないのではないか」と考える人もいますが、私はそうは思いません。短所は、やるべきではないこと、遠ざけておいたほうがいいことを知らせるために与えられたものだと思うからです。 舩井幸雄,ja,[],[],[],0,8,40,[],[],https://twitter.com/yukiofunaibot/status/1408198251799400452,False,,0,,,,,,,,[],,,,
1407835865993207808,1407835865993207808,2021-06-23 23:00:01 UTC,2021-06-23,23:00:01,+0000,126230151,yukiofunaibot,舩井幸雄bot,,「なぜ自分だけがこんな目にあわなければならないんだ？」とふてくされたくなるときもあると思いますが、それは試練です。この試練は、いったい自分に何を教えようとして来たのだろう、と考えてみると、必ずそこから学ぶことができるものです。 舩井幸雄,ja,[],[],[],0,3,24,[],[],https://twitter.com/yukiofunaibot/status/1407835865993207808,False,,0,,,,,,,,[],,,,
1407473477683056652,1407473477683056652,2021-06-22 23:00:01 UTC,2021-06-22,23:00:01,+0000,126230151,yukiofunaibot,舩井幸雄bot,,自分はたった一人なのに、世界中の他人を敵に回して、自分の優位性を主張し、相手を打ち負かし、やりたいことを押し通すなどムリなことです。勝ちたい、人より先じたい、と思えば思うほど、自分を苦しめます。だから少しエゴを抑えて、他人を受け入れてみてください。格段に楽になります。 舩井幸雄,ja,[],[],[],0,1,23,[],[],https://twitter.com/yukiofunaibot/status/1407473477683056652,False,,0,,,,,,,,[],,,,
1407111087984496641,1407111087984496641,2021-06-21 23:00:00 UTC,2021-06-21,23:00:00,+0000,126230151,yukiofunaibot,舩井幸雄bot,,人のいいところと、自分のいいところは違う。どちらかが圧倒的に勝者になるのではなく、それぞれが違う土俵で、お互いの幸せを享受すればいいのです。 舩井幸雄,ja,[],[],[],0,2,30,[],[],https://twitter.com/yukiofunaibot/status/1407111087984496641,False,,0,,,,,,,,[],,,,
